{"run":29,"commit":"ccb8202","metric":28.974,"metrics":{"web_local_s":1.367,"web_trunk_build_s":1.379,"web_trunk_build_cold_s":3.223,"web_trunk_build_cold_system_wasm_bindgen_s":1.409,"mcp_local_s":1.271,"tui_local_s":6.974,"modeled_jobs":3,"modeled_unknown_steps":0,"observed_ci_run_id":25161888248,"observed_ci_run_count":5},"status":"keep","description":"Make the proxy select exact observed CI timings from successful runs whose job step names match the current workflow, instead of always seeding from the latest successful branch run.","timestamp":1777548023281,"segment":4,"confidence":11.001084745762716,"asi":{"hypothesis":"The proxy should compare a candidate workflow against historical CI runs with the same job-step topology; otherwise a changed workflow can inherit misleading exact timings from an unrelated latest branch run and overfit badly.","root_cause_evidence":"Recent experiments showed that actual CI contradicted some proxy wins because the script always seeded exact job-step timings from the latest successful branch run, even when the candidate workflow had different step sets such as `Install wasm-bindgen` or different web-lane structure. Matching on ordered job step names is a stronger invariant for apples-to-apples reuse of exact CI timings.","benchmark_change":"`autoresearch.sh` now scans recent successful branch runs, computes a step-name fingerprint per job, and uses the most recent runs whose job step names exactly match the current workflow for exact timings and step averages. It falls back to the latest successful runs only when no exact workflow match exists.","changed_files":["autoresearch.sh"],"rollback_reason":"","next_action_hint":"Re-evaluate the system-wasm-bindgen change against this workflow-aware proxy by removing the explicit install step and seeing whether the model now lines up better with the known better actual run `25161542044`."}}
{"run":30,"commit":"0000000","metric":28.338,"metrics":{"web_local_s":1.421,"web_trunk_build_s":1.449,"web_trunk_build_cold_s":2.878,"web_trunk_build_cold_system_wasm_bindgen_s":1.431,"mcp_local_s":1.259,"tui_local_s":6.338,"modeled_jobs":3,"modeled_unknown_steps":0,"observed_ci_run_id":25161888248,"observed_ci_run_count":5},"status":"discard","description":"Tried removing the explicit web-job wasm-bindgen install to unwind the previous system-wasm-bindgen experiment.","timestamp":1777548126947,"segment":4,"confidence":12.26964083175804,"asi":{"hypothesis":"Now that the proxy is workflow-aware, removing the explicit system wasm-bindgen install should compare against the historically matching no-install workflow and may realign the branch with the known-better actual run 25161542044.","root_cause_evidence":"The attempt exposed a benchmark bug: GitHub's observed job step lists include the synthetic `Set up job` step, but the workflow fingerprint logic compared them directly against YAML-defined steps and therefore found no exact workflow match. The proxy silently fell back to the latest successful branch run instead of the intended matching historical run.","rollback_reason":"Cannot trust this result because the workflow-matching benchmark logic was incomplete; fix the synthetic-step matching bug first, then retry the no-install candidate.","next_action_hint":"Exclude synthetic steps like `Set up job` from workflow fingerprint matching in `autoresearch.sh`, rerun the benchmark improvement, and then retry the no-system-wasm-bindgen workflow comparison."}}
{"run":31,"commit":"0e9c8d0","metric":29.302,"metrics":{"web_local_s":1.37,"web_trunk_build_s":1.421,"web_trunk_build_cold_s":3.565,"web_trunk_build_cold_system_wasm_bindgen_s":1.395,"mcp_local_s":1.278,"tui_local_s":7.302,"modeled_jobs":3,"modeled_unknown_steps":0,"observed_ci_run_id":25161888248,"observed_ci_run_count":1},"status":"keep","description":"Fix the workflow-aware proxy to ignore GitHub’s synthetic `Set up job` step when matching historical CI runs against the current workflow step fingerprint.","timestamp":1777548203401,"segment":4,"confidence":14.117452583956855,"asi":{"hypothesis":"Exact-workflow matching is only useful if it ignores GitHub-generated synthetic steps that are not present in the YAML; otherwise even truly matching historical runs are misclassified as non-matches.","root_cause_evidence":"Direct inspection of `gh run view` showed successful runs like 25161542044 include `Set up job` ahead of all user-defined steps. The initial workflow-fingerprint logic compared those raw step lists against the YAML-defined steps, so no historical runs could ever match exactly.","benchmark_change":"`autoresearch.sh` now excludes `Set up job` from the run-side workflow fingerprint before comparing observed runs to the current YAML. This preserves exact matching on real user-defined steps while still allowing synthetic setup time to be modeled separately via fallback/observed step timings.","changed_files":["autoresearch.sh"],"rollback_reason":"","next_action_hint":"Retry the no-system-wasm-bindgen workflow now that the proxy can actually match it against historical run 25161542044 instead of silently falling back to the latest different workflow."}}
{"run":32,"commit":"817ffcf","metric":18.702,"metrics":{"web_local_s":1.342,"web_trunk_build_s":1.377,"web_trunk_build_cold_s":3.36,"web_trunk_build_cold_system_wasm_bindgen_s":1.4,"mcp_local_s":1.314,"tui_local_s":6.773,"modeled_jobs":3,"modeled_unknown_steps":0,"observed_ci_run_id":25161542044,"observed_ci_run_count":3},"status":"keep","description":"Unwind the explicit web-job wasm-bindgen install now that the proxy can compare this workflow against matching historical no-install CI runs.","timestamp":1777548276934,"segment":4,"confidence":12.26964083175804,"asi":{"hypothesis":"The previous system-wasm-bindgen keep was a proxy artifact. Once the benchmark compares this candidate against exact historical runs with the same no-install workflow, the branch should realign with the actual best-known CI topology.","root_cause_evidence":"After fixing workflow matching, the no-install candidate now correctly selects observed CI run 25161542044 as its exact historical baseline instead of the newer install-wasm-bindgen run 25161888248. That historical no-install run is also the current best actual branch result (`web=85s`, `tui=36s`, `mcp=13s`).","changed_files":[".github/workflows/ci.yml"],"workflow_strategy":"retain the current preinstalled Rust / static-dist / Cucumber-parallel / Playwright-6-worker topology, but remove the explicit `Install wasm-bindgen` step and let Trunk manage wasm-bindgen as before","benchmark_caveat":"The projected metric only nudges slightly because the primary value here is agreement with real CI evidence, not a large new local speedup.","rollback_reason":"","next_action_hint":"Push and validate on real CI. If the branch returns to or beats the known 85s web run, keep the branch aligned to this no-install workflow and stop revisiting system-wasm-bindgen installs."}}
{"run":33,"commit":"0000000","metric":22.791,"metrics":{"web_local_s":1.372,"web_trunk_build_s":1.381,"web_trunk_build_cold_s":3.419,"web_trunk_build_cold_system_wasm_bindgen_s":1.424,"mcp_local_s":1.281,"tui_local_s":7.112,"modeled_jobs":3,"modeled_unknown_steps":0,"observed_ci_run_id":25162727553,"observed_ci_run_count":4},"status":"discard","description":"Tried shrinking the shared browser viewport from 1000x800 to 760x560 for both Playwright and Cucumber-driven browser runs.","timestamp":1777548996780,"segment":4,"confidence":13.344243421052635,"asi":{"hypothesis":"A smaller shared viewport should reduce screenshot size and pixel-processing cost in the web suites without changing coverage, potentially shaving a few seconds from the web lane.","root_cause_evidence":"Local CI-like runs stayed green and the legacy suite improved from about 3.8s to 3.4s at 760x560, while Cucumber remained roughly flat. However the workflow-aware proxy anchored itself to the latest matching observed run 25162727553, which is a slower no-install run than the 85s rerun evidence for the same topology.","verification":"Added a failing config test asserting the shared viewport contract, updated the shared viewport in both browser paths, reran the targeted config tests, reran `pnpm -C apps/egui-web run test:preflight`, and reran CI-like external-server Cucumber plus legacy Playwright suites; all passed.","rollback_reason":"The projected metric regressed under the current exact-run selection logic, so this is not strong enough to justify a real CI push yet.","next_action_hint":"Revert the viewport shrink for now and improve the workflow-aware proxy so matching-run reuse is less sensitive to one slow latest success (for example, use a central tendency across matching runs). Then retry this candidate if it still looks promising."}}
{"run":34,"commit":"8b1799c","metric":25.084,"metrics":{"web_local_s":1.366,"web_trunk_build_s":1.387,"web_trunk_build_cold_s":6.718,"web_trunk_build_cold_system_wasm_bindgen_s":1.4,"mcp_local_s":1.243,"tui_local_s":6.768,"modeled_jobs":3,"modeled_unknown_steps":0,"observed_ci_run_id":25162727553,"observed_ci_run_count":4},"status":"keep","description":"Make the workflow-aware proxy use the median duration across matching historical runs for exact job-step timings instead of trusting the most recent matching run wholesale.","timestamp":1777549092423,"segment":4,"confidence":13.60150880134116,"asi":{"hypothesis":"When there are several matching historical CI runs for the same workflow, using the median exact duration per job-step should reduce noise from a single unlucky run and make the proxy less brittle for close-call optimization decisions.","root_cause_evidence":"The no-install workflow now has multiple matching successful CI runs with materially different outcomes (for example, 85s reruns and a slower 93s fresh run). Seeding exact timings from only the latest matching run makes the proxy swing with that one sample instead of the broader evidence for the same topology.","benchmark_change":"`autoresearch.sh` now collects exact job-step timings across all matching historical runs and uses the median per `[job, step]` pair as well as the median per step name, rather than taking exact timings only from the newest match.","changed_files":["autoresearch.sh"],"rollback_reason":"","next_action_hint":"Re-evaluate close-call web candidates such as the smaller shared viewport under this median-based proxy; it should now be less sensitive to one noisy matching run."}}
{"run":35,"commit":"0000000","metric":22.059,"metrics":{"web_local_s":1.347,"web_trunk_build_s":1.362,"web_trunk_build_cold_s":3.712,"web_trunk_build_cold_system_wasm_bindgen_s":1.414,"mcp_local_s":1.281,"tui_local_s":6.778,"modeled_jobs":3,"modeled_unknown_steps":0,"observed_ci_run_id":25162727553,"observed_ci_run_count":4},"status":"discard","description":"Retried shrinking the shared browser viewport from 1000x800 to 760x560 after improving the workflow-aware proxy.","timestamp":1777549236722,"segment":4,"confidence":13.370632827949898,"asi":{"hypothesis":"With the proxy now using median timings across matching runs, the smaller shared viewport should get a cleaner comparison and may show a real win if screenshot/pixel-processing cost matters on CI.","root_cause_evidence":"Local CI-like suites remained green and the legacy suite again improved modestly (about 3.8s → 3.3s), but even under the median-based workflow-aware proxy the candidate still came out clearly worse than the current branch baseline.","verification":"Reintroduced the failing viewport contract test, changed both Playwright and Cucumber browser paths to use the smaller shared viewport, reran the targeted config tests, reran `pnpm -C apps/egui-web run test:preflight`, and reran CI-like external-server Cucumber plus legacy Playwright suites; all passed.","rollback_reason":"Still not enough proxy evidence to justify spending another real CI run on a close-call optimization that has already looked marginal twice.","next_action_hint":"Revert the viewport change and focus on benchmark integrity or entirely different bottlenecks rather than more micro-tuning of the current web test settings."}}
{"run":36,"commit":"d25b8c0","metric":21.553,"metrics":{"web_local_s":1.375,"web_trunk_build_s":1.413,"web_trunk_build_cold_s":3.178,"web_trunk_build_cold_system_wasm_bindgen_s":1.385,"mcp_local_s":1.258,"tui_local_s":6.973,"modeled_jobs":3,"modeled_unknown_steps":0,"observed_ci_run_id":25162727553,"observed_ci_run_count":4},"status":"keep","description":"Make the proxy measure cold Trunk tool-setup paths as the median of three local runs instead of trusting a single network-sensitive sample.","timestamp":1777549494350,"segment":4,"confidence":12.815195071868587,"asi":{"hypothesis":"The cold `trunk build` variants are noisy because they include network-backed wasm-bindgen download behavior, so the proxy should take a median across several local cold runs before using those numbers to judge Trunk-tool experiments.","root_cause_evidence":"Single-sample cold Trunk measurements swung from roughly 3.2s to 6.7s across nearby runs even when the workflow did not materially change. That kind of variance can distort close-call decisions about no-install versus Trunk-tool setup lanes.","benchmark_change":"`autoresearch.sh` now measures both cold Trunk variants (`web_trunk_build_cold_s` and `web_trunk_build_cold_system_wasm_bindgen_s`) as the median of three isolated local runs, while still leaving warmed local commands as single measurements.","changed_files":["autoresearch.sh"],"rollback_reason":"","next_action_hint":"With the cold Trunk measurements stabilized, focus the next experiment on a genuinely different bottleneck rather than more micro-tuning of already-discarded web viewport/worker/cache variants."}}
{"run":37,"commit":"0000000","metric":0,"metrics":{"web_local_s":1.375,"web_trunk_build_s":1.413,"web_trunk_build_cold_s":3.178,"web_trunk_build_cold_system_wasm_bindgen_s":1.385,"mcp_local_s":1.258,"tui_local_s":6.973,"modeled_jobs":3,"modeled_unknown_steps":0,"observed_ci_run_id":25162727553,"observed_ci_run_count":4},"status":"crash","description":"Tried measuring all local validation commands as medians of three runs instead of single samples.","timestamp":1777549967331,"segment":4,"confidence":12.815195071868587,"asi":{"hypothesis":"If the warmed local web, MCP, and TUI commands are also somewhat noisy, taking medians across three runs should make the proxy less brittle for close-call workflow decisions.","root_cause_evidence":"The experiment exposed a benchmark harness bug rather than a meaningful metric result: the repeated BDD measurement reused a fixed port (`4174`) and collided with an already-running local server, producing `OSError: [Errno 98] Address already in use` from `python3 -m http.server`. The current single-run benchmark path often got away with that because an existing external server sometimes satisfied the tests anyway, masking the bind failure.","rollback_reason":"Cannot trust this experiment result because the measurement harness was flaky under repeated local web-suite runs.","next_action_hint":"First harden the benchmark harness so repeated CI-like web-suite measurements use isolated dynamic ports instead of a fixed shared port. Then retry the local-command median idea.","error_detail":"Repeated `test:bdd` benchmarking on a fixed port is incompatible with the long-lived local egui-web server expectation and can either fail hard or silently ride on an unrelated existing server."}}
{"run":38,"commit":"8be07c3","metric":29.547,"metrics":{"web_local_s":7.935,"web_trunk_build_s":1.37,"web_trunk_build_cold_s":4.612,"web_trunk_build_cold_system_wasm_bindgen_s":1.392,"mcp_local_s":1.441,"tui_local_s":6.746,"modeled_jobs":3,"modeled_unknown_steps":0,"observed_ci_run_id":25163578570,"observed_ci_run_count":5},"status":"keep","description":"Fix the proxy’s CI-like web-suite benchmark harness so BDD and legacy Playwright actually run from `apps/egui-web` on isolated dynamic ports, then measure local run-step timings as medians of three runs.","timestamp":1777550304803,"segment":4,"confidence":13.370632827949898,"asi":{"hypothesis":"The next benchmark-integrity gap was the warmed local run-step sampling: repeated medians should reduce noise, but only after the CI-like web-suite harness is corrected to use isolated ports and a shell structure that actually runs the tests from `apps/egui-web`.","root_cause_evidence":"Investigation showed the old web benchmark command had two correctness bugs. First, it reused fixed port `4174`, which collided with the long-lived local egui-web server requirement and could silently piggyback on an unrelated existing server. Second, the `cd ... && python3 ... & ... pnpm run ...` shell structure backgrounded the `cd` together with the server start, so the later `pnpm run test:bdd` / `test:pw-legacy` could execute from the repo root instead of `apps/egui-web`. The corrected harness now uses multiline shell commands, dynamic free ports, and three-run medians; this raised `web_local_s` from an implausible ~1.3s to a believable ~7.9s, confirming the previous local web-step model was under-measuring reality.","benchmark_change":"`autoresearch.sh` now measures warmed local commands (`test:preflight`, warmed `trunk build`, BDD, legacy Playwright, MCP check, TUI check`) as medians of three runs. The BDD and legacy measurements now allocate an ephemeral localhost port per run and keep all setup plus `pnpm run` execution inside the intended `apps/egui-web` shell context.","changed_files":["autoresearch.sh"],"rollback_reason":"","next_action_hint":"With the proxy no longer under-measuring local web run steps, re-evaluate hypotheses against this corrected benchmark and avoid spending real CI runs on wins that only exist under the old broken local harness."}}
{"run":39,"commit":"1c3f807","metric":28.126,"metrics":{"web_local_s":7.527,"web_trunk_build_s":1.353,"web_trunk_build_cold_s":3.599,"web_trunk_build_cold_system_wasm_bindgen_s":1.353,"mcp_local_s":1.386,"tui_local_s":6.788,"modeled_jobs":3,"modeled_unknown_steps":0,"observed_ci_run_id":25163578570,"observed_ci_run_count":5},"status":"keep","description":"Raise the CI-only Playwright legacy worker cap from 6 to 7 after the corrected local web benchmark showed a small stable speedup without the flakiness seen at 8+ workers.","timestamp":1777550707166,"segment":4,"confidence":13.60150880134116,"asi":{"hypothesis":"The legacy Playwright suite may still have a little unused parallelism beyond the validated 6-worker setting, and 7 workers could be a safe middle ground that preserves stability while shaving a few tenths of a second locally.","root_cause_evidence":"After fixing the local web benchmark harness, ad-hoc CI-like legacy runs showed 7 workers consistently finishing around 4.2–4.5s versus roughly 4.4–4.6s for 6 workers. Higher values (8, 10, 12) exposed intermittent test failures and long slowdowns, so the safe search space narrowed to a bounded step up rather than aggressive fan-out.","verification":"Changed the config test to require 7 CI workers and observed it fail first, updated `apps/egui-web/playwright.config.cjs`, reran the targeted config test, reran `pnpm -C apps/egui-web run test:preflight`, reran one CI-like BDD suite, and reran the CI-like legacy suite twice against isolated external static servers; all passed.","rollback_reason":"","next_action_hint":"Push this 7-worker candidate to real CI next. If the actual `Web Playwright legacy (static dist)` step drops below the current best 45s neighborhood without introducing flakes, keep it; otherwise revert and treat 6 as the stable ceiling."}}
{"run":40,"commit":"c1ee675","metric":28.023,"metrics":{"web_local_s":7.704,"web_trunk_build_s":1.344,"web_trunk_build_cold_s":4.319,"web_trunk_build_cold_system_wasm_bindgen_s":1.358,"mcp_local_s":1.212,"tui_local_s":6.485,"modeled_jobs":3,"modeled_unknown_steps":0,"observed_ci_run_id":25164375879,"observed_ci_run_count":5},"status":"keep","description":"Restore the CI-only Playwright legacy worker cap from 7 back to 6 after real GitHub Actions evidence showed 7 workers made the web job slower overall.","timestamp":1777551079008,"segment":4,"confidence":14.626464755723813,"asi":{"hypothesis":"The small corrected-local speedup at 7 workers was likely overfitting to local conditions; restoring 6 workers should realign the branch with the better real-CI behavior once we account for the new actual run.","root_cause_evidence":"Real GitHub Actions run `25164375879` on the 7-worker candidate finished successfully but regressed the web job to about 92s overall, with `Web Playwright legacy (static dist)` around 44s and the full workflow wall clock around 107s. That is worse than the validated 85s-best no-install baseline, so actual CI overruled the local-only proxy win. After folding that run back into the benchmark context, the corrected proxy also nudged back toward the 6-worker configuration.","verification":"Changed the config test back to require 6 CI workers and observed it fail first, restored `apps/egui-web/playwright.config.cjs`, reran the targeted config test, reran `pnpm -C apps/egui-web run test:preflight`, reran one CI-like BDD suite, and reran one CI-like legacy Playwright suite against isolated external static servers; all passed.","rollback_reason":"","next_action_hint":"Treat 6 workers as the current stable ceiling again. Prune the >6-worker lane from the ideas backlog and look for a different bottleneck than raw Playwright worker fan-out."}}
