{"type":"config","name":"Optimize qni-webgpu GitHub Actions CI runtime","metricName":"projected_ci_s","metricUnit":"s","bestDirection":"lower"}
{"run":1,"commit":"a53ea62","metric":956.375,"metrics":{"web_local_s":18.111,"mcp_local_s":1.846,"tui_local_s":7.418,"modeled_jobs":1,"modeled_unknown_steps":0},"status":"keep","description":"Baseline projected CI critical path from the current single-job workflow using latest successful Actions setup timings plus fresh local check durations.","timestamp":1777537335175,"segment":0,"confidence":null,"asi":{"hypothesis":"Current single-job CI serializes web, mcp, and tui checks behind two expensive cargo-install setup steps, so job topology is the highest-leverage first optimization.","latest_success_run":"25151678429","baseline_actual_ci_s":1125,"rollback_reason":"","next_action_hint":"Try splitting the workflow into parallel jobs that separate trunk/web setup from cargo-audit-deny/tui setup."}}
{"run":2,"commit":"3382419","metric":486.499,"metrics":{"web_local_s":17.499,"mcp_local_s":1.701,"tui_local_s":6.521,"modeled_jobs":3,"modeled_unknown_steps":0},"status":"keep","description":"Split the single CI job into parallel web, mcp, and tui jobs while preserving the same validation commands, and enabled pnpm cache/frozen-lockfile installs for the Node jobs.","timestamp":1777537440910,"segment":0,"confidence":null,"asi":{"hypothesis":"Breaking the workflow into independent jobs should overlap the expensive trunk install and cargo-audit-deny install instead of serializing them behind one critical path.","projected_improvement_s":469.876,"changed_files":[".github/workflows/ci.yml"],"workflow_strategy":"parallelize web/mcp/tui jobs with direct per-job commands","rollback_reason":"","next_action_hint":"Validate the projected win against a fresh local review, then explore faster Rust tool installation or caching for the remaining dominant web/tui setup steps."}}
{"run":3,"commit":"b44ada1","metric":484.271,"metrics":{"web_local_s":15.271,"mcp_local_s":1.459,"tui_local_s":6.803,"modeled_jobs":3,"modeled_unknown_steps":0},"status":"keep","description":"Replace cargo-install-based trunk and cargo-audit/cargo-deny setup with taiki-e/install-action prebuilt binaries and add rust-cache to web/tui jobs.","timestamp":1777539543102,"segment":0,"confidence":211.89587073608536,"asi":{"hypothesis":"Prebuilt Rust tool installers plus rust-cache should collapse the remaining trunk and cargo-audit/cargo-deny setup bottlenecks without changing validation coverage.","actual_ci_run":"25156094906","actual_ci_wall_s":179,"actual_web_job_s":167,"actual_tui_job_s":94,"actual_mcp_job_s":17,"actual_install_trunk_s":1,"actual_install_cargo_audit_deny_s":0,"proxy_limit":"projected_ci_s still uses old fixed setup timings and now materially overestimates real CI after switching installer strategy.","next_action_hint":"Recalibrate the proxy to current workflow timings, prune tried ideas, then explore smaller remaining setup wins such as folding wasm target install into toolchain setup or stabilizing required-check aggregation only if it preserves runtime."}}
{"run":4,"commit":"0000000","metric":484.545,"metrics":{"web_local_s":15.545,"mcp_local_s":1.481,"tui_local_s":7.872,"modeled_jobs":3,"modeled_unknown_steps":0},"status":"discard","description":"Tried combining BDD and legacy Playwright under one shared trunk server in the web job via a new test:ci-web runner and Playwright external-server mode.","timestamp":1777539952665,"segment":0,"confidence":423.79174147215986,"asi":{"hypothesis":"Running BDD and legacy Playwright against one pre-started trunk server should avoid duplicated web-server bootstrap and reduce the web job critical path.","rollback_reason":"The projected metric regressed slightly and the combined local web command was slower than the current separate commands, so there is no evidence this orchestration pays for its added complexity.","next_action_hint":"Revert the shared-server web runner and try a lower-risk setup optimization next, such as folding the wasm target into rust-toolchain setup or recalibrating the proxy to current CI timings before chasing smaller wins.","observed_web_local_delta_s":0.274,"notes":"BDD already reuses an external server when one exists, but adding a combined CI-only runner plus Playwright external-server mode did not produce a measurable local improvement."}}
{"run":5,"commit":"6901892","metric":482.636,"metrics":{"web_local_s":15.636,"mcp_local_s":1.502,"tui_local_s":6.888,"modeled_jobs":3,"modeled_unknown_steps":0},"status":"keep","description":"Fold the web job's wasm32 target install into dtolnay/rust-toolchain so CI drops the standalone rustup target step while keeping the same toolchain setup.","timestamp":1777540093348,"segment":0,"confidence":248.16081718177162,"asi":{"hypothesis":"Installing wasm32-unknown-unknown through dtolnay/rust-toolchain should remove one dedicated setup step from the web job and slightly shorten the critical path without changing validation coverage.","expected_ci_delta_s":2,"changed_files":[".github/workflows/ci.yml"],"workflow_strategy":"merge wasm target provisioning into Setup Rust for the web job","rollback_reason":"","next_action_hint":"Push this keep and inspect the real CI run; if the gain is marginal, the next promising lane is recalibrating the proxy to the post-install-action workflow or caching Playwright/browser setup."}}
{"type":"config","name":"Optimize qni-webgpu GitHub Actions CI runtime (recalibrated proxy)","metricName":"projected_ci_s","metricUnit":"s","bestDirection":"lower"}
{"run":6,"commit":"e88dbbd","metric":159,"metrics":{"web_local_s":15.463,"mcp_local_s":1.495,"tui_local_s":8.112,"modeled_jobs":3,"modeled_unknown_steps":0,"observed_ci_run_id":25157172723},"status":"keep","description":"Recalibrate the CI runtime proxy to seed per-step costs from the latest successful branch run instead of stale cargo-install-era timings.","timestamp":1777540500105,"segment":1,"confidence":null,"asi":{"hypothesis":"Using the latest successful CI run as the proxy seed should keep future local experiments aligned with post-install-action reality, especially for topology changes that duplicate formerly expensive setup steps.","benchmark_change":"projected_ci_s now derives observed step durations from the latest successful branch CI run and falls back to local timings or legacy constants only when no observed step exists.","observed_ci_run_id":25157172723,"rollback_reason":"","next_action_hint":"Now that the proxy reflects current CI shape, try splitting the web suites into parallel jobs; the actual bottleneck is 74s BDD + 48s legacy inside one 168s web job."}}
{"run":7,"commit":"3bc0bec","metric":110.167,"metrics":{"web_local_s":15.564,"mcp_local_s":1.454,"tui_local_s":6.836,"modeled_jobs":4,"modeled_unknown_steps":0,"observed_ci_run_id":25157172723},"status":"keep","description":"Split the web validation lane into parallel web-bdd and web-legacy jobs so the two longest web suites overlap instead of serializing inside one job.","timestamp":1777540580671,"segment":1,"confidence":null,"asi":{"hypothesis":"Now that setup is cheap, duplicating the web job setup should cost less than serializing the 74s BDD suite and 48s legacy Playwright suite behind one critical path.","observed_ci_run_id":25157172723,"changed_files":[".github/workflows/ci.yml"],"workflow_strategy":"parallelize the two web suites into separate jobs while keeping the same commands and coverage","rollback_reason":"","next_action_hint":"Push this change and compare the real CI wall clock against run 25157172723; if branch protection needs a stable web check name, add a tiny aggregate job only after measuring the pure speed win."}}
{"run":8,"commit":"55ba767","metric":83,"metrics":{"web_local_s":15.417,"mcp_local_s":1.446,"tui_local_s":7.651,"modeled_jobs":5,"modeled_unknown_steps":0,"observed_ci_run_id":25157503984},"status":"keep","description":"Add a web-build artifact job that runs trunk build once, then serve the built dist to parallel web-bdd and web-legacy jobs so the expensive cold compile is not repeated inside legacy Playwright.","timestamp":1777541315761,"segment":1,"confidence":2.797511686973166,"asi":{"hypothesis":"If the split-web regression comes from redoing a 54.9s trunk compile inside the isolated legacy job, building dist once and reusing it via artifact should preserve parallelism while removing the cold compile from both test jobs.","root_cause_evidence":"Run 25157503984 showed web-legacy spent 54.92s compiling qni-egui-web before tests, while the warmed single-web legacy step in run 25157172723 compiled in ~0.15s and finished the suite in 44.9s.","changed_files":[".github/workflows/ci.yml","apps/egui-web/playwright.config.cjs","apps/egui-web/test-support/web-server.cjs","apps/egui-web/test-node/playwright-config.test.cjs","apps/egui-web/test-node/web-server.test.cjs"],"workflow_strategy":"centralize trunk build in web-build, upload dist, then run BDD and legacy against a static http.server with Playwright external-server mode","rollback_reason":"","next_action_hint":"Push and validate against real CI; if wall clock improves, consider a tiny aggregate web status job only if required-check naming becomes a problem."}}
{"type":"config","name":"Optimize qni-webgpu GitHub Actions CI runtime (dependency-aware proxy)","metricName":"projected_ci_s","metricUnit":"s","bestDirection":"lower"}
{"run":9,"commit":"5c66003","metric":160,"metrics":{"web_local_s":15.265,"mcp_local_s":1.45,"tui_local_s":6.549,"modeled_jobs":5,"modeled_unknown_steps":0,"observed_ci_run_id":25158006800},"status":"keep","description":"Make the CI runtime proxy dependency-aware by computing the longest path through workflow job needs instead of assuming every job runs fully in parallel.","timestamp":1777541697896,"segment":2,"confidence":null,"asi":{"hypothesis":"A dependency-aware proxy should stop overestimating wins from workflows that insert serial build jobs before downstream test jobs.","benchmark_change":"projected_ci_s now sums per-job durations along the longest needs chain, not just the max standalone job duration.","observed_ci_run_id":25158006800,"actual_ci_wall_s":199,"rollback_reason":"","next_action_hint":"Use this new 160s baseline to evaluate a single-web-job static-dist hypothesis, which may keep one compile while avoiding the serial web-build bottleneck."}}
{"run":10,"commit":"0000000","metric":161.583,"metrics":{"web_local_s":15.513,"mcp_local_s":1.454,"tui_local_s":6.399,"modeled_jobs":3,"modeled_unknown_steps":0,"observed_ci_run_id":25158006800},"status":"discard","description":"Tried collapsing back to one web job that builds dist once and then runs BDD plus legacy against the static output, avoiding trunk serve inside both suites.","timestamp":1777541792763,"segment":2,"confidence":null,"asi":{"hypothesis":"A single static-dist web job might keep one compile while removing the serial web-build → web-legacy chain and duplicated browser/dependency setup.","rollback_reason":"Under the dependency-aware proxy this came out slightly worse than the current artifact-split baseline, so there is not enough evidence to justify another real CI run yet.","next_action_hint":"Return to the slower-but-measured artifact split baseline and try a smaller verified win next, such as reducing per-web-job Playwright browser install cost or adding queue-aware telemetry before exploring topology again.","notes":"This candidate likely trades serial dependency overhead for a larger single web job, but the current model does not show a win."}}
{"run":11,"commit":"f6328b3","metric":148,"metrics":{"web_local_s":15.481,"mcp_local_s":1.445,"tui_local_s":6.533,"modeled_jobs":5,"modeled_unknown_steps":0,"observed_ci_run_id":25158006800},"status":"keep","description":"Remove the explicit Playwright Chromium install from web-bdd and web-legacy so both jobs reuse the runner's preinstalled system browser through the shared browser policy.","timestamp":1777542079958,"segment":2,"confidence":7.580543272267853,"asi":{"hypothesis":"Because ubuntu-latest already ships a system Chrome/Chromium, teaching the plain-browser path to resolve that binary should let both web test jobs skip the 12s Playwright browser install step entirely.","root_cause_evidence":"The shared browser policy already prefers system Chrome for standard mode, and runner-images documentation plus existing command lookup logic indicate ubuntu-latest exposes Chrome in PATH; only the plain-browser path still forced Playwright's downloaded defaultPath.","changed_files":[".github/workflows/ci.yml","apps/egui-web/test-support/browser-launch.cjs","apps/egui-web/test-node/playwright-browser.test.cjs"],"workflow_strategy":"use system-installed browser for both standard and plain modes, eliminating explicit playwright install steps from the split web artifact workflow","rollback_reason":"","next_action_hint":"Push and validate on real CI; if the runner truly has the browser preinstalled, this should cut ~24s from the artifact-split path and may finally beat the earlier 168s warmed single-web run."}}
{"run":12,"commit":"ac4a1b6","metric":148,"metrics":{"web_local_s":15.201,"mcp_local_s":1.452,"tui_local_s":6.35,"modeled_jobs":5,"modeled_unknown_steps":0,"observed_ci_run_id":25158006800},"status":"keep","description":"Keep the system-browser Playwright hypothesis, but fix the browser-launch preflight contract so plain mode still falls back to bundled Chromium when no system browser exists.","timestamp":1777542304288,"segment":2,"confidence":2,"asi":{"hypothesis":"Skipping explicit Playwright installs remains promising if plain mode prefers a system browser when available but still preserves the bundled fallback contract for environments without Chrome in PATH.","root_cause_evidence":"Run 25158549124 failed in web-build preflight, not in CI runtime behavior: browser-launch.test expected plain mode to always use the bundled Chromium, but the new helper intentionally preferred system Chrome when present.","actual_ci_run":"25158549124","actual_ci_failure":"web-build preflight test mismatch in browser-launch.test.cjs","changed_files":["apps/egui-web/test-node/browser-launch.test.cjs"],"rollback_reason":"","next_action_hint":"Push the repaired keep and re-run real CI to measure whether removing explicit Playwright installs lowers the artifact-split workflow below the previous 199s wall clock."}}
{"type":"config","name":"Optimize qni-webgpu GitHub Actions CI runtime (history-aware dependency proxy)","metricName":"projected_ci_s","metricUnit":"s","bestDirection":"lower"}
{"run":13,"commit":"c4db99e","metric":150,"metrics":{"web_local_s":15.323,"mcp_local_s":1.452,"tui_local_s":6.531,"modeled_jobs":5,"modeled_unknown_steps":0,"observed_ci_run_id":25158709932,"observed_ci_run_count":5},"status":"keep","description":"Make the dependency-aware proxy history-aware by averaging step-name timings across several recent successful branch runs while keeping exact job/step timings from the latest success.","timestamp":1777542657700,"segment":3,"confidence":null,"asi":{"hypothesis":"A history-aware proxy should evaluate workflow shapes more honestly by reusing empirical timings for step names seen in older successful topologies instead of falling back to misleading warm local command durations.","benchmark_change":"projected_ci_s now seeds exact job-step durations from the latest successful branch run and step-name averages from the latest five successful branch runs.","observed_ci_run_id":25158709932,"observed_ci_run_count":5,"actual_ci_wall_s":180,"rollback_reason":"","next_action_hint":"Use this 150s baseline to evaluate a warmed single-web workflow with no explicit Playwright install; the proxy can now borrow historical Web Cucumber BDD / Web Playwright legacy timings from earlier successful runs."}}
{"run":14,"commit":"0000000","metric":171.117,"metrics":{"web_local_s":15.124,"mcp_local_s":1.443,"tui_local_s":6.798,"modeled_jobs":3,"modeled_unknown_steps":0,"observed_ci_run_id":25158709932,"observed_ci_run_count":5},"status":"discard","description":"Tried reverting to a single warmed web job with no explicit Playwright browser install, letting BDD warm the trunk compile before legacy Playwright runs.","timestamp":1777542751668,"segment":3,"confidence":null,"asi":{"hypothesis":"With system-browser fallback in place, the old single-web topology might regain its warmed-compile advantage and beat the split artifact workflow without paying any Playwright install cost.","rollback_reason":"The history-aware proxy still modeled this topology as slower than the current artifact-based branch, so there is not enough evidence to spend another real CI run here.","next_action_hint":"Return to the artifact-based no-browser-install baseline and explore smaller wins that preserve the current 180s actual wall clock, such as reducing web-build trunk build cost or artifact overhead.","notes":"The proxy can now see historical single-web timings, and those were not strong enough to offset the loss of parallelism against the current branch baseline."}}
{"type":"config","name":"Optimize qni-webgpu GitHub Actions CI runtime (history-aware proxy with local command timings)","metricName":"projected_ci_s","metricUnit":"s","bestDirection":"lower"}
{"run":15,"commit":"c18c83c","metric":98.893,"metrics":{"web_local_s":7.323,"mcp_local_s":1.464,"tui_local_s":6.373,"modeled_jobs":5,"modeled_unknown_steps":0,"observed_ci_run_id":25158709932,"observed_ci_run_count":5},"status":"keep","description":"Use local command timings for modeled test steps and make the legacy Playwright suite parallel-safe so fullyParallel can reduce the web test runtime without fixed screenshot-path collisions.","timestamp":1777543032498,"segment":4,"confidence":null,"asi":{"hypothesis":"If modeled test steps use fresh local command timings instead of stale historical durations, the proxy can see real gains from enabling fullyParallel once the legacy Playwright suite stops sharing fixed /tmp screenshot paths.","benchmark_change":"Command-like workflow steps now use fresh local measurements first; observed CI history remains the source of truth for non-command setup steps and fallback timing.","changed_files":["autoresearch.sh","apps/egui-web/playwright.config.cjs","apps/egui-web/tests/egui-web.spec.js","apps/egui-web/test-node/playwright-config.test.cjs","apps/egui-web/test-node/legacy-playwright-suite.test.cjs"],"root_cause_evidence":"Legacy Playwright was stuck on one worker and shared hard-coded /tmp screenshot paths; after switching to testInfo.outputPath and fullyParallel, local web runtime dropped from ~15.3s to ~7.3s.","rollback_reason":"","next_action_hint":"Push and validate on real CI; if the web-legacy step actually drops in the artifact workflow, compare the new wall clock against the current 180s branch run and then decide whether another topology change is still needed."}}
{"run":16,"commit":"9e3fb4b","metric":86.464,"metrics":{"web_local_s":7.378,"mcp_local_s":1.458,"tui_local_s":6.945,"modeled_jobs":3,"modeled_unknown_steps":0,"observed_ci_run_id":25159226468,"observed_ci_run_count":5},"status":"keep","description":"Collapse the no-browser artifact workflow into one static-dist web job so trunk build happens once and BDD plus legacy run serially against the same built output without artifact fan-out.","timestamp":1777543333017,"segment":4,"confidence":null,"asi":{"hypothesis":"Now that legacy is parallel-safe and the explicit browser install is gone, a single static-dist web job should be faster than the artifact fan-out because it avoids upload/download plus downstream job startup while still paying the trunk build only once.","root_cause_evidence":"The current best actual run 25159226468 still spends 84s in web-build and then another 63s in downstream web-legacy; collapsing those into one warmed job removes the serial artifact boundary.","changed_files":[".github/workflows/ci.yml"],"workflow_strategy":"single web job with preflight -> trunk build -> BDD static dist -> legacy static dist, plus unchanged mcp/tui parallel jobs","rollback_reason":"","next_action_hint":"Push and validate on real CI; if actual wall clock drops below 162s, compare against the old warmed-trunk 168s run and consider stopping or only chasing the remaining 55s trunk build cost."}}
