{"run":48,"commit":"0000000","metric":80,"metrics":{"web_local_s":8.341,"web_trunk_build_s":1.306,"web_trunk_build_cold_s":6.214,"web_trunk_build_cold_system_wasm_bindgen_s":1.363,"web_static_suites_s":0,"mcp_local_s":1.287,"tui_local_s":6.333,"modeled_jobs":4,"modeled_unknown_steps":0,"observed_ci_run_id":25199557265,"observed_ci_run_count":5,"observed_ci_selection_tier":2,"observed_ci_matching_run_count":12,"observed_ci_exact_runtime_run_count":6,"observed_ci_exact_run_runtime_count":9,"observed_ci_view_failure_count":0},"status":"discard","description":"Clean control after reverting the frame-wait candidate; exact baseline is now around 80s with the latest noisy CI run included.","timestamp":1777603132325,"segment":2,"confidence":14.860333333333335,"asi":{"hypothesis":"After the frame-wait revert, the branch should regain exact-runtime matching and return to the validated split-step baseline.","root_cause_evidence":"The control selected run 25199557265 at selection tier 2 with six exact-runtime matching runs. The latest web run was noisy at 87s, and the median exact proxy now reports 80s.","rollback_reason":"This was a control-only run; no source change was intended to be kept. The ideas backlog was updated separately to mark lower Playwright workers stale after a local timeout.","next_action_hint":"Continue from the 80s exact baseline. Avoid local-only wait/worker micro-tuning; collect or infer CI-specific legacy bottlenecks before changing tests again."}}
{"run":49,"commit":"ec302cb","metric":80,"metrics":{"web_local_s":8.293,"web_trunk_build_s":1.345,"web_trunk_build_cold_s":8.421,"web_trunk_build_cold_system_wasm_bindgen_s":1.372,"web_static_suites_s":0,"mcp_local_s":1.3,"tui_local_s":6.335,"modeled_jobs":4,"modeled_unknown_steps":0,"observed_ci_run_id":25199557265,"observed_ci_run_count":5,"observed_ci_selection_tier":2,"observed_ci_matching_run_count":12,"observed_ci_exact_runtime_run_count":6,"observed_ci_exact_run_runtime_count":9,"observed_ci_view_failure_count":0},"status":"keep","description":"Emit the retired `web_static_suites_s` secondary metric as zero so future logs stay schema-compatible after reverting the shared-server candidate.","timestamp":1777603308348,"segment":2,"confidence":12.737428571428572,"asi":{"hypothesis":"Because `web_static_suites_s` was briefly tracked during a reverted candidate, keeping it explicitly emitted as zero will prevent future log_experiment calls from failing on a missing secondary metric while preserving the reverted benchmark shape.","benchmark_change":"Added `METRIC web_static_suites_s=0` and a source test documenting that it is a retired compatibility metric. No CI workflow or product/test runtime behavior changed.","verification":"Ran `bash -n autoresearch.sh`, `node --test test-node/autoresearch-script.test.cjs`, and `./autoresearch.sh` successfully. The benchmark remained exact-runtime tier 2 with projected_ci_s=80.","changed_files":["autoresearch.sh","test-node/autoresearch-script.test.cjs","autoresearch.ideas.md"],"next_action_hint":"Continue from the 80s exact baseline. The next runtime experiment should be based on CI-specific evidence rather than local-only micro-tuning."}}
{"run":50,"commit":"3a5f12f","metric":78,"metrics":{"web_local_s":8.507,"web_trunk_build_s":1.309,"web_trunk_build_cold_s":5.634,"web_trunk_build_cold_system_wasm_bindgen_s":1.364,"web_static_suites_s":0,"mcp_local_s":1.438,"tui_local_s":6.851,"modeled_jobs":4,"modeled_unknown_steps":0,"observed_ci_run_id":25199732491,"observed_ci_run_count":5,"observed_ci_selection_tier":1,"observed_ci_matching_run_count":13,"observed_ci_exact_runtime_run_count":0,"observed_ci_exact_run_runtime_count":0,"observed_ci_view_failure_count":0},"status":"keep","description":"Switch the legacy Playwright script to the list reporter so CI logs include per-test durations for future bottleneck selection.","timestamp":1777603505451,"segment":2,"confidence":14.860333333333335,"asi":{"hypothesis":"CI-specific per-test durations are needed before more legacy Playwright micro-tuning. Playwright's list reporter prints each test duration while preserving the same test command and assertions.","implementation":"Changed `apps/egui-web` `test:pw-legacy` from `playwright test` to `playwright test --reporter=list` and updated the package-script preflight test.","verification":"Ran `pnpm -C apps/egui-web run test:preflight`, then ran the legacy suite against an external static server and confirmed the list reporter prints per-test durations. Reran `./autoresearch.sh` successfully.","benchmark_note":"This is primarily observability. It changes runtime files, so the proxy is workflow-match tier 1 until the pushed CI run completes. Revert only if the reporter materially slows the real `Web Playwright legacy` step.","coverage_note":"No validation coverage changed; all 13 legacy Playwright tests still run.","changed_files":["apps/egui-web/package.json","apps/egui-web/test-node/cucumber-config.test.cjs"],"next_action_hint":"Push and inspect the real CI logs/durations. Use the per-test timings to choose the next evidence-backed optimization."}}
{"run":51,"commit":"0000000","metric":0,"metrics":{"web_local_s":0,"web_trunk_build_s":0,"web_trunk_build_cold_s":0,"web_trunk_build_cold_system_wasm_bindgen_s":0,"web_static_suites_s":0,"mcp_local_s":0,"tui_local_s":0,"modeled_jobs":0,"modeled_unknown_steps":0,"observed_ci_run_id":0,"observed_ci_run_count":0,"observed_ci_selection_tier":0,"observed_ci_matching_run_count":0,"observed_ci_exact_runtime_run_count":0,"observed_ci_exact_run_runtime_count":0,"observed_ci_view_failure_count":0},"status":"crash","description":"Tried raising CI Playwright workers from 6 to 8 based on CI list-reporter timing evidence, but local bounded benchmark became flaky and failed.","timestamp":1777603848223,"segment":2,"confidence":14.860333333333335,"asi":{"hypothesis":"The CI per-test list output showed 13 long tests running in two waves with 6 workers, so increasing to 8 workers might reduce the legacy Playwright makespan if GitHub runner contention stayed tolerable.","root_cause_evidence":"Local CI-like benchmark attempts with 8 workers became unstable: attempts 2 and 3 timed out waiting for app startup in `placed circuit gate keeps its visual while dragging another gate`, and attempt 5 timed out in two startup-heavy tests. The bounded autoresearch benchmark failed before emitting metrics.","rollback_reason":"8 workers is not robust enough even locally; do not send this to CI.","next_action_hint":"Keep the list reporter for observability, but leave workers at 6. If worker count is revisited, try a narrower `7` only after addressing startup timeouts or adding stronger evidence."}}
{"run":52,"commit":"0000000","metric":83,"metrics":{"web_local_s":8.709,"web_trunk_build_s":1.345,"web_trunk_build_cold_s":6.213,"web_trunk_build_cold_system_wasm_bindgen_s":1.369,"web_static_suites_s":0,"mcp_local_s":1.383,"tui_local_s":6.72,"modeled_jobs":4,"modeled_unknown_steps":0,"observed_ci_run_id":25199813669,"observed_ci_run_count":1,"observed_ci_selection_tier":2,"observed_ci_matching_run_count":14,"observed_ci_exact_runtime_run_count":1,"observed_ci_exact_run_runtime_count":1,"observed_ci_view_failure_count":0},"status":"discard","description":"Exact CI check for the Playwright list reporter showed useful per-test durations but no projected runtime improvement.","timestamp":1777604002689,"segment":2,"confidence":12.737428571428572,"asi":{"hypothesis":"Switching to the Playwright list reporter should provide CI per-test durations with little or no runtime cost.","root_cause_evidence":"Real CI run 25199813669 on 3a5f12f succeeded and printed per-test durations. The web job was 85s and legacy step 44s, comparable to recent noisy baselines, but exact projected_ci_s for this runtime change is 83 with only one exact run, not an improvement over the current 80s baseline.","per_test_ci_evidence":"The slowest CI legacy tests were `egui webgpu canvas renders content` 24.3s, `dragging does not grow state vector until drop` 21.9s, `H on q0 and q1` 17.7s, `placed circuit gate keeps its visual` 17.4s, and several drag visual tests around 15-17s. Total reported per-test duration was about 204.5s across 13 tests, explaining the ~44s wall time with 6 workers.","rollback_reason":"The reporter produced useful diagnostic data, but it is not a runtime improvement and should not remain if the primary metric is worse.","next_action_hint":"Revert the list reporter now that timings are captured. Use the recorded CI timings to target actual slow tests rather than keeping permanent reporter overhead."}}
{"run":53,"commit":"6db303d","metric":79,"metrics":{"web_local_s":8.292,"web_trunk_build_s":1.347,"web_trunk_build_cold_s":6.152,"web_trunk_build_cold_system_wasm_bindgen_s":1.341,"web_static_suites_s":0,"mcp_local_s":1.345,"tui_local_s":6.362,"modeled_jobs":4,"modeled_unknown_steps":0,"observed_ci_run_id":25199813669,"observed_ci_run_count":5,"observed_ci_selection_tier":1,"observed_ci_matching_run_count":14,"observed_ci_exact_runtime_run_count":0,"observed_ci_exact_run_runtime_count":0,"observed_ci_view_failure_count":0},"status":"keep","description":"Revert the Playwright list reporter after capturing CI per-test timings, returning the legacy script to the default reporter.","timestamp":1777604150281,"segment":2,"confidence":14.860333333333335,"asi":{"hypothesis":"Now that one CI run has emitted per-test timings, reverting the temporary list reporter restores the lower-noise/default legacy Playwright command while retaining the diagnostic evidence in ASI and ideas.","root_cause_evidence":"The exact list-reporter run projected 83s with one exact runtime match and was not a runtime improvement. The useful timing evidence has been copied into `autoresearch.ideas.md`, so the reporter no longer needs to remain in the workflow.","verification":"Restored `apps/egui-web/package.json` and `test-node/cucumber-config.test.cjs`, ran `pnpm -C apps/egui-web run test:preflight`, and reran `./autoresearch.sh` successfully.","benchmark_note":"The revert is workflow-match tier 1 while the runtime files are dirty relative to the list-reporter commit. Push and let CI recreate exact evidence for the default reporter before the next runtime candidate.","changed_files":["apps/egui-web/package.json","apps/egui-web/test-node/cucumber-config.test.cjs","autoresearch.ideas.md"],"next_action_hint":"Use the captured CI per-test timings to target the high-cost startup/render tests. Avoid reporter/worker/wait tuning loops unless new evidence supports them."}}
{"run":54,"commit":"fec3402","metric":79,"metrics":{"web_local_s":8.172,"web_trunk_build_s":1.362,"web_trunk_build_cold_s":4.605,"web_trunk_build_cold_system_wasm_bindgen_s":1.403,"web_static_suites_s":0,"mcp_local_s":1.239,"tui_local_s":6.871,"modeled_jobs":4,"modeled_unknown_steps":0,"observed_ci_run_id":25200065334,"observed_ci_run_count":5,"observed_ci_selection_tier":1,"observed_ci_matching_run_count":15,"observed_ci_exact_runtime_run_count":0,"observed_ci_exact_run_runtime_count":0,"observed_ci_view_failure_count":0},"status":"keep","description":"Trim duplicate Bell-state interactions from the legacy canvas-render smoke test while preserving render and state assertions covered elsewhere.","timestamp":1777604402337,"segment":2,"confidence":17.8324,"asi":{"hypothesis":"The slowest CI legacy test, `egui webgpu canvas renders content`, duplicates Bell-state interaction coverage that is already exercised by dedicated H/CNOT/control tests. Removing the duplicate control/X interactions from the smoke test should reduce its runtime while preserving render-content validation and state coverage elsewhere.","implementation":"The canvas smoke now checks initial render, applies one H gate, verifies the expected state vector, and checks post-interaction canvas content/screenshot. A source test guards that the smoke no longer duplicates Bell-state/control coverage.","verification":"Ran `pnpm -C apps/egui-web run test:preflight`, ran CI-like external-server `pnpm run test:pw-legacy`, and reran `./autoresearch.sh` successfully with zero unknown modeled steps.","benchmark_note":"This modifies runtime test code, so the proxy is workflow-match tier 1 until real CI for this commit completes. The local legacy suite remained green and `web_local_s` improved to 8.172s, but real CI must confirm the slow smoke test improves.","coverage_note":"No assertion category is removed from the suite: Bell-state and control semantics remain covered by the dedicated legacy tests; the smoke test retains initial and post-interaction canvas render checks.","changed_files":["apps/egui-web/tests/egui-web.spec.js","apps/egui-web/test-node/legacy-playwright-suite.test.cjs"],"next_action_hint":"Push and compare the next real CI legacy step and, if possible, re-enable list reporter temporarily only if exact per-test confirmation is needed."}}
{"run":55,"commit":"091cbc2","metric":78,"metrics":{"web_local_s":8.544,"web_trunk_build_s":1.367,"web_trunk_build_cold_s":6.093,"web_trunk_build_cold_system_wasm_bindgen_s":1.426,"web_static_suites_s":0,"mcp_local_s":1.369,"tui_local_s":6.371,"modeled_jobs":4,"modeled_unknown_steps":0,"observed_ci_run_id":25200168055,"observed_ci_run_count":1,"observed_ci_selection_tier":2,"observed_ci_matching_run_count":16,"observed_ci_exact_runtime_run_count":1,"observed_ci_exact_run_runtime_count":1,"observed_ci_view_failure_count":0},"status":"keep","description":"Exact CI validation of the trimmed canvas smoke test confirmed a faster web job and legacy Playwright step.","timestamp":1777604650488,"segment":2,"confidence":17.8324,"asi":{"hypothesis":"The trimmed canvas-render smoke test should reduce CI legacy runtime by removing duplicated Bell-state interactions from the slowest test while preserving coverage in dedicated tests.","root_cause_evidence":"Real CI run 25200168055 on fec3402 succeeded with `web=79s` and `Web Playwright legacy=40s`, improving over recent reverted/list-reporter runs (`web=85-87s`, legacy `44-45s`). The exact proxy selected this run at tier 2 and projected 78s.","verification":"Post-push `./autoresearch.sh` selected the candidate run exactly with zero unknown steps. CI itself passed all required jobs: web-preflight, web, mcp, and tui.","coverage_note":"The dedicated H/CNOT/control legacy tests still cover the removed Bell-state/control interactions; the smoke still verifies WebGPU availability, initial canvas render, one H-gate interaction, state vector update, and post-interaction canvas render/screenshot.","changed_files":[],"next_action_hint":"Continue from the 78s exact candidate baseline. Next target should use the CI timing evidence for another high-cost duplicate/over-broad legacy test, not worker/wait tuning."}}
{"run":56,"commit":"028dc9e","metric":76,"metrics":{"web_local_s":8.311,"web_trunk_build_s":1.398,"web_trunk_build_cold_s":5.415,"web_trunk_build_cold_system_wasm_bindgen_s":1.375,"web_static_suites_s":0,"mcp_local_s":1.294,"tui_local_s":6.986,"modeled_jobs":4,"modeled_unknown_steps":0,"observed_ci_run_id":25200272029,"observed_ci_run_count":5,"observed_ci_selection_tier":1,"observed_ci_matching_run_count":15,"observed_ci_exact_runtime_run_count":0,"observed_ci_exact_run_runtime_count":0,"observed_ci_view_failure_count":1},"status":"keep","description":"Use the smallest circuit in the drag-growth legacy test to verify delayed state growth with one setup gate instead of two.","timestamp":1777604999723,"segment":2,"confidence":17.8324,"asi":{"hypothesis":"The `dragging does not grow state vector until drop` test can cover the delayed-growth behavior with a single placed H gate, then drag that gate to a farther qubit and assert the vector remains length 4 during drag and grows only after drop. This should reduce setup work compared with placing two gates first.","implementation":"Removed the second setup drag from that legacy test, changed the during-drag expectation from length 8 to 4, kept the after-drop growth assertion at length 16, and added a source test documenting the minimal circuit contract.","verification":"Ran `pnpm -C apps/egui-web run test:preflight`, ran CI-like external-server `pnpm run test:pw-legacy`, and reran `./autoresearch.sh` successfully with zero unknown modeled steps.","benchmark_note":"The proxy is workflow-match tier 1 because runtime test code is dirty until this commit's CI completes. One `gh run view` call failed while collecting observations (`observed_ci_view_failure_count=1`), but enough matching runs were available for a conservative projection. Real CI is required before accepting the 76s projection.","coverage_note":"The test still verifies the same delayed-growth invariant: moving a gate to a farther qubit does not grow the state vector until the pointer is released.","changed_files":["apps/egui-web/tests/egui-web.spec.js","apps/egui-web/test-node/legacy-playwright-suite.test.cjs"],"next_action_hint":"Push and compare the real CI web/legacy durations against the 78s exact candidate baseline."}}
{"run":57,"commit":"16c06dd","metric":76,"metrics":{"web_local_s":8.535,"web_trunk_build_s":1.386,"web_trunk_build_cold_s":10.913,"web_trunk_build_cold_system_wasm_bindgen_s":1.373,"web_static_suites_s":0,"mcp_local_s":1.236,"tui_local_s":6.349,"modeled_jobs":4,"modeled_unknown_steps":0,"observed_ci_run_id":25200415664,"observed_ci_run_count":1,"observed_ci_selection_tier":2,"observed_ci_matching_run_count":17,"observed_ci_exact_runtime_run_count":1,"observed_ci_exact_run_runtime_count":1,"observed_ci_view_failure_count":0},"status":"keep","description":"Exact CI validation for the minimal drag-growth test kept the legacy step at the improved 40s level and projected 76s.","timestamp":1777605259907,"segment":2,"confidence":17.252708978328155,"asi":{"hypothesis":"The minimal drag-growth circuit should preserve the delayed-growth assertion while shaving setup work from the legacy Playwright lane.","root_cause_evidence":"Real CI run 25200415664 on 028dc9e succeeded with exact selection tier 2, `web=80s`, BDD `9s`, and legacy Playwright `40s`. This keeps the legacy step at the improved level from the previous canvas-smoke trim and the proxy projects 76s.","verification":"Post-push `./autoresearch.sh` selected the candidate run exactly with zero unknown modeled steps. All CI jobs succeeded.","coverage_note":"The test still asserts the vector remains length 4 during drag and grows to length 16 only after release, preserving the delayed-growth behavior under a smaller setup circuit.","changed_files":[],"next_action_hint":"Continue from the 76s exact candidate baseline. Further gains likely require reducing BDD/legacy render/startup costs or another over-broad high-cost visual test."}}
{"run":58,"commit":"0000000","metric":84.318,"metrics":{"web_local_s":7.989,"web_trunk_build_s":1.337,"web_trunk_build_cold_s":16.318,"web_trunk_build_cold_system_wasm_bindgen_s":1.358,"web_static_suites_s":0,"mcp_local_s":1.35,"tui_local_s":6.597,"modeled_jobs":4,"modeled_unknown_steps":0,"observed_ci_run_id":25200520918,"observed_ci_run_count":5,"observed_ci_selection_tier":1,"observed_ci_matching_run_count":17,"observed_ci_exact_runtime_run_count":0,"observed_ci_exact_run_runtime_count":0,"observed_ci_view_failure_count":0},"status":"discard","description":"Tried removing a duplicate visible wait in the BDD canvas-render step, but the workflow-match proxy did not improve.","timestamp":1777605551402,"segment":2,"confidence":16.70952023988002,"asi":{"hypothesis":"Because the BDD startup scenario already has a dedicated visible-canvas assertion before the canvas-render assertion, removing the repeated `canvas.waitFor({ state: 'visible' })` inside the render step might shave BDD time without weakening coverage.","verification":"Added a source test, removed the duplicate wait, ran `pnpm -C apps/egui-web run test:preflight`, ran CI-like external-server `pnpm run test:bdd`, and reran `./autoresearch.sh` successfully.","rollback_reason":"The proxy worsened to 84.318s despite a lower local web bundle, so this micro-optimization is not worth keeping or pushing to real CI.","next_action_hint":"Do not pursue tiny BDD visible-wait cleanup. Focus on high-cost legacy tests or wait for more exact CI data around the kept legacy trims."}}
{"run":59,"commit":"0000000","metric":76,"metrics":{"web_local_s":7.869,"web_trunk_build_s":1.36,"web_trunk_build_cold_s":15.735,"web_trunk_build_cold_system_wasm_bindgen_s":1.37,"web_static_suites_s":0,"mcp_local_s":1.256,"tui_local_s":6.757,"modeled_jobs":4,"modeled_unknown_steps":0,"observed_ci_run_id":25200520918,"observed_ci_run_count":2,"observed_ci_selection_tier":2,"observed_ci_matching_run_count":17,"observed_ci_exact_runtime_run_count":2,"observed_ci_exact_run_runtime_count":2,"observed_ci_view_failure_count":0},"status":"discard","description":"Clean control after the minimal drag-growth commit; exact baseline remains 76s with two matching runtime runs.","timestamp":1777605756352,"segment":2,"confidence":15.730769230769214,"asi":{"hypothesis":"After the latest kept legacy trims, a clean control should exact-match the branch and stabilize the baseline.","root_cause_evidence":"The control selected run 25200520918 at tier 2 with two exact-runtime runs and projected_ci_s=76. The latest real run had `web=80s`, `BDD=16s`, and `legacy=32s`, showing the legacy lane improved substantially but BDD noise can dominate within the web job.","rollback_reason":"Control-only run with no intended source change; metric matched the current candidate baseline.","next_action_hint":"Continue from 76s. Further runtime wins should consider BDD variance and remaining high-cost legacy tests; avoid tiny BDD cleanup that does not survive the proxy."}}
