{"run":17,"commit":"21315df","metric":86.173,"metrics":{"web_local_s":7.173,"mcp_local_s":1.462,"tui_local_s":6.426,"modeled_jobs":3,"modeled_unknown_steps":0,"observed_ci_run_id":25159433581,"observed_ci_run_count":5},"status":"keep","description":"Configure Swatinem/rust-cache with explicit subdirectory workspaces for apps/egui-web and apps/tui so cache discovery uses the real Cargo roots instead of failing cargo metadata at repo root.","timestamp":1777544131875,"segment":4,"confidence":43.711340206186044,"asi":{"hypothesis":"The current Rust cache restore is partially blind because both web and tui jobs run in a repo without a root Cargo.toml; pointing rust-cache at the real subproject workspaces should let it restore and save the correct target directories, reducing trunk build and tui check time on CI without changing coverage.","root_cause_evidence":"Successful CI run 25159433581 shows both web and tui Cache Rust artifacts steps invoking `cargo metadata --all-features --format-version 1 --no-deps` at `/home/runner/work/qni-webgpu/qni-webgpu` and erroring with `could not find Cargo.toml`, while the actual Cargo projects live under `apps/egui-web` and `apps/tui`.","changed_files":[".github/workflows/ci.yml","autoresearch.ideas.md"],"workflow_strategy":"keep the current single static-dist web topology and only fix rust-cache workspace discovery for the two Rust-backed jobs","benchmark_caveat":"The projected metric only moves slightly because local command timings dominate the proxy, but this candidate specifically targets a CI-only cache miss visible in GitHub Actions logs.","rollback_reason":"","next_action_hint":"Push and validate on real CI; if wall clock improves, inspect how much Web trunk build and TUI check dropped, then decide whether the next lane is residual trunk build cost or stopping at the new best actual runtime."}}
{"run":18,"commit":"63b3b69","metric":36.349,"metrics":{"web_local_s":7.349,"mcp_local_s":1.478,"tui_local_s":6.891,"modeled_jobs":3,"modeled_unknown_steps":0,"observed_ci_run_id":25159979620,"observed_ci_run_count":5},"status":"keep","description":"Force the legacy Playwright suite to use 4 workers on CI so the warmed static-dist web job no longer serializes all 13 legacy browser tests behind Playwright’s default 1-worker CI cap.","timestamp":1777544846457,"segment":4,"confidence":9.833962264150944,"asi":{"hypothesis":"Playwright defaults to 1 worker on CI even with fullyParallel enabled, so explicitly setting a modest CI worker count should materially reduce the remaining 45s legacy step without changing test coverage or browser policy.","root_cause_evidence":"Warm-cache rerun 25159979620 still printed `Running 13 tests using 1 worker` and spent 45.1s in `Web Playwright legacy (static dist)`. A local CI-like static-dist run showed the same suite dropping from 11.9s at `--workers=1` to 5.1s at `--workers=4`, while still passing.","verification":"Added a failing config test asserting CI uses 4 workers, made it pass, reran `pnpm -C apps/egui-web run test:preflight`, and reran a CI-like static-dist legacy suite with `CI=1` plus the external server; all passed and the legacy suite reported `Running 13 tests using 4 workers` with 13/13 passing.","changed_files":["apps/egui-web/playwright.config.cjs","apps/egui-web/test-node/playwright-config.test.cjs"],"benchmark_caveat":"The big projected metric drop also reflects the newly warmed cache-aware observed CI run 25159979620 from the previous workspace fix. Real CI validation is still needed to isolate the incremental effect of the worker change itself.","rollback_reason":"","next_action_hint":"Push and validate on GitHub Actions with warmed caches; if the web job drops meaningfully below 100s, inspect whether any further work beyond this point is worth the added complexity."}}
{"run":19,"commit":"0000000","metric":37.316,"metrics":{"web_local_s":7.316,"mcp_local_s":1.479,"tui_local_s":6.386,"modeled_jobs":3,"modeled_unknown_steps":0,"observed_ci_run_id":25160458002,"observed_ci_run_count":5},"status":"discard","description":"Tried raising the CI-only Playwright worker cap from 4 to 6 for the warmed static-dist legacy suite.","timestamp":1777545197828,"segment":4,"confidence":4.916981132075472,"asi":{"hypothesis":"If the remaining 4-worker legacy suite is still underutilizing the runner, nudging CI to 6 workers might shave a few more seconds off the 42s legacy step without destabilizing the suite.","root_cause_evidence":"A local CI-like static-dist run improved from 4.2s at 4 workers to 3.7s at 6 workers, but the already-pushed 4-worker CI run only reduced the legacy step from 45.1s to 42.2s, so the expected incremental gain was modest.","verification":"Updated the config test to require 6 CI workers, reran the targeted config test, reran `pnpm -C apps/egui-web run test:preflight`, and reran a CI-like static-dist legacy suite; all passed and the local legacy run reported `Running 13 tests using 6 workers` with 13/13 passing.","rollback_reason":"The projected metric regressed slightly after incorporating the latest observed 4-worker CI run, and the expected real-world gain over 4 workers looks too small to justify another push/run right now.","next_action_hint":"Revert to the validated 4-worker setting and investigate higher-leverage remaining costs instead, especially Rust toolchain/setup overhead and the residual wasm-bindgen download inside the warmed web build."}}
{"run":20,"commit":"d2fe04c","metric":27.416,"metrics":{"web_local_s":7.416,"mcp_local_s":1.435,"tui_local_s":6.841,"modeled_jobs":3,"modeled_unknown_steps":0,"observed_ci_run_id":25160458002,"observed_ci_run_count":5},"status":"keep","description":"Drop dtolnay/rust-toolchain from the warmed PR workflow and rely on the runner’s preinstalled Rust toolchain, keeping only an explicit wasm32 target add in web.","timestamp":1777545314727,"segment":4,"confidence":2.852519205826599,"asi":{"hypothesis":"Warm-cache PR runs are now paying mostly for rustup refreshing stable from the runner’s already-installed toolchain. Removing the explicit toolchain action should save roughly 10-12s on the critical web path and another ~11s on tui while preserving the same checks.","root_cause_evidence":"Run 25160458002 showed `Setup Rust` spending 12s in web and 11s in tui. The web log also showed the runner already had Rust 1.94.1 plus components installed, and dtolnay/rust-toolchain spent its time syncing stable, removing the old components, downloading six components, and upgrading to 1.95.0 before the actual job work began.","changed_files":[".github/workflows/ci.yml","autoresearch.ideas.md"],"workflow_strategy":"use the preinstalled Rust toolchain on ubuntu-latest, add only `rustup target add wasm32-unknown-unknown` for the web job, and leave the warmed rust-cache/static-dist topology otherwise unchanged","risk":"This trades explicit rust-toolchain refreshes for the runner image’s bundled stable toolchain. Because rust-toolchain.toml only requests `stable` plus fmt/clippy and not an exact patch version, the main risk is slightly looser patch freshness rather than a validation-coverage change.","rollback_reason":"","next_action_hint":"Push and validate on real CI. If the runner already has everything needed, the warmed branch wall clock should drop below the current 94s. If it fails or regresses, restore explicit toolchain setup and focus on residual wasm-bindgen/web legacy cost instead."}}
{"run":21,"commit":"0f93c21","metric":33.716,"metrics":{"web_local_s":7.193,"web_trunk_build_s":1.523,"mcp_local_s":1.439,"tui_local_s":6.527,"modeled_jobs":3,"modeled_unknown_steps":0,"observed_ci_run_id":25160767677,"observed_ci_run_count":5},"status":"keep","description":"Teach the CI runtime proxy to measure local warmed `trunk build` time explicitly so wasm-bindgen and web-build optimizations are visible instead of being hidden behind stale observed CI step durations.","timestamp":1777545949435,"segment":4,"confidence":7.219898989898989,"asi":{"hypothesis":"The current proxy is blind to the remaining web-build bottleneck because it does not locally measure `Web trunk build`, so trunk/wasm-bindgen improvements can look neutral or worse until after an expensive real CI run.","root_cause_evidence":"On warmed CI rerun 25160767677, `Web trunk build` was only ~5s and clearly dominated by non-compile overhead, but the proxy still had to borrow historical observed step timings instead of a fresh local build measurement. Local warmed `trunk build` currently completes in ~1.5s, which is a much better predictor for follow-up web-build experiments than the old fallback.","benchmark_change":"`autoresearch.sh` now measures warmed local `env -u NO_COLOR TRUNK_COLOR=never trunk build` in `apps/egui-web`, emits `web_trunk_build_s`, and uses that timing when modeling the `Web trunk build` workflow step.","changed_files":["autoresearch.sh"],"rollback_reason":"","next_action_hint":"Use the new benchmark visibility to test caching Trunk-managed wasm-bindgen artifacts next; that is now the clearest remaining web critical-path target."}}
{"run":22,"commit":"0000000","metric":34.721,"metrics":{"web_local_s":7.336,"web_trunk_build_s":1.385,"mcp_local_s":1.476,"tui_local_s":6.879,"modeled_jobs":3,"modeled_unknown_steps":0,"observed_ci_run_id":25160767677,"observed_ci_run_count":5},"status":"discard","description":"Tried adding an explicit GitHub Actions cache for Trunk-managed tool downloads under ~/.cache/trunk in the web job.","timestamp":1777546028538,"segment":4,"confidence":11.40620761190458,"asi":{"hypothesis":"Caching `~/.cache/trunk` should let warmed CI runs skip Trunk's per-run wasm-bindgen download/install and shave a couple more seconds from the web critical path.","root_cause_evidence":"Trunk 0.21.14 stores downloaded tools in `ProjectDirs::from(\"dev\", \"trunkrs\", \"trunk\").cache_dir()` (Linux: `~/.cache/trunk`) and will use that cache when the required wasm-bindgen version is present. Warm CI logs still show `INFO downloading wasm-bindgen` inside `Web trunk build` after Rust artifacts are restored.","rollback_reason":"Under the improved proxy this regressed slightly because local `trunk build` is already fully warm, so the extra cache restore step adds cost while the benchmark cannot observe any further local gain. That makes this a CI-only cache optimization with insufficient proxy evidence to justify another remote run right now.","next_action_hint":"Revert this workflow-only trunk cache idea for now. The next higher-signal lane is to prune the stale rust-toolchain idea and either accept the current near-best state or investigate whether a more explicit actual-CI acceptance rule is needed for CI-only cache experiments."}}
{"run":23,"commit":"caf6d49","metric":27.798,"metrics":{"web_local_s":1.381,"web_trunk_build_s":1.417,"mcp_local_s":1.271,"tui_local_s":6.334,"modeled_jobs":3,"modeled_unknown_steps":0,"observed_ci_run_id":25160767677,"observed_ci_run_count":5},"status":"keep","description":"Model the web suites in CI-like external-server mode and enable bounded Cucumber scenario parallelism on CI so the proxy reflects the actual static-dist workflow and the BDD lane can overlap its three scenarios.","timestamp":1777546256062,"segment":4,"confidence":8.35890539118232,"asi":{"hypothesis":"The proxy should measure the web suites under the same `CI=1` external-server conditions as the workflow, and once it does, giving Cucumber a small CI-only parallelism budget should reduce the BDD step without changing scenario coverage.","root_cause_evidence":"`pnpm run test:bdd` locally completed in ~1.9s, but the workflow's static-dist BDD step took ~13s because it runs under `CI=1` with an external server. A local CI-like run against the static dist improved from ~2.67s at `--parallel 1` to ~1.76s at `--parallel 2`, while still passing all 3 scenarios / 13 steps.","benchmark_change":"`autoresearch.sh` now measures BDD and legacy under `CI=1` with the same external static-server contract used in GitHub Actions, instead of measuring the looser local default mode.","verification":"Added a failing cucumber config test asserting CI uses bounded parallelism, made it pass, reran the targeted cucumber config tests, reran `pnpm -C apps/egui-web run test:preflight`, and reran a CI-like external-server Cucumber run; all passed.","changed_files":["autoresearch.sh","apps/egui-web/cucumber.cjs","apps/egui-web/test-node/cucumber-config.test.cjs"],"rollback_reason":"","next_action_hint":"Push and validate on real CI; if the BDD step drops materially below the current ~13s, inspect whether the current branch finally beats the previous 94s warmed wall-clock run by a convincing margin."}}
{"run":24,"commit":"b492222","metric":18.756,"metrics":{"web_local_s":1.357,"web_trunk_build_s":1.399,"mcp_local_s":1.272,"tui_local_s":6.932,"modeled_jobs":3,"modeled_unknown_steps":0,"observed_ci_run_id":25161387752,"observed_ci_run_count":5},"status":"keep","description":"Raise the CI-only Playwright worker cap from 4 to 6 now that the proxy measures the legacy suite in CI-like external-server mode.","timestamp":1777546494190,"segment":4,"confidence":10.108097880928359,"asi":{"hypothesis":"With the benchmark now exercising the legacy suite under `CI=1` static-dist conditions, raising the Playwright worker cap from 4 to 6 should show whether the remaining ~40s CI legacy step is still underutilizing the runner.","root_cause_evidence":"The updated benchmark plus direct CI-like local runs show `playwright test` dropping from roughly 4.2s at 4 workers to about 3.8s at 6 workers against the external static server, while all 13 tests still pass. The earlier discard happened before the proxy could observe CI-like legacy behavior directly.","verification":"Updated the CI worker-count config test to fail on the old value, made it pass at 6 workers, reran the targeted Playwright config tests, reran `pnpm -C apps/egui-web run test:preflight`, and reran a CI-like external-server legacy Playwright suite; all passed.","changed_files":["apps/egui-web/playwright.config.cjs","apps/egui-web/test-node/playwright-config.test.cjs"],"rollback_reason":"","next_action_hint":"Push and validate on real CI; if the legacy step falls materially below ~42s and the web job beats the new 88s branch run, keep this lane. If not, revert to 4 workers and stop revisiting worker-count tuning."}}
{"run":25,"commit":"0ef70a4","metric":18.621,"metrics":{"web_local_s":1.364,"web_trunk_build_s":1.374,"web_trunk_build_cold_s":3.257,"web_trunk_build_cold_system_wasm_bindgen_s":1.424,"mcp_local_s":1.272,"tui_local_s":6.932,"modeled_jobs":3,"modeled_unknown_steps":0,"observed_ci_run_id":25161542044,"observed_ci_run_count":5},"status":"keep","description":"Make the proxy model `Web trunk build` using cold Trunk tool-cache timings, and distinguish between the current no-system-wasm-bindgen path and a system-wasm-bindgen path for future workflow experiments.","timestamp":1777546934411,"segment":4,"confidence":10.988637919233408,"asi":{"hypothesis":"The proxy should model Trunk's wasm-bindgen setup cost under an empty tool cache, because CI runners are ephemeral and the remaining web-build optimization is specifically about avoiding that cold tool download path.","root_cause_evidence":"Trunk 0.21.14 first looks for a matching system `wasm-bindgen` on PATH, and only downloads into `~/.cache/trunk` if it cannot find one. Local measurements with an empty `XDG_CACHE_HOME` showed cold `trunk build` taking ~3.26s without a system tool and ~1.42s when a matching `wasm-bindgen` binary was prepended to PATH, which aligns with the CI logs that still show `INFO downloading wasm-bindgen` before an ~8s trunk build.","benchmark_change":"`autoresearch.sh` now measures warmed trunk build, cold trunk build with an empty Trunk tool cache, and cold trunk build with a matching system wasm-bindgen on PATH. The workflow model uses the cold-system variant only when the web job explicitly installs wasm-bindgen; otherwise it uses the cold no-system variant.","changed_files":["autoresearch.sh"],"rollback_reason":"","next_action_hint":"Use this improved model to test installing a matching system wasm-bindgen in the web job next; that hypothesis now has a proxy signal grounded in CI-like cold-tool behavior."}}
{"run":26,"commit":"841a132","metric":17.76,"metrics":{"web_local_s":1.36,"web_trunk_build_s":1.38,"web_trunk_build_cold_s":2.858,"web_trunk_build_cold_system_wasm_bindgen_s":1.4,"mcp_local_s":1.26,"tui_local_s":6.715,"modeled_jobs":3,"modeled_unknown_steps":0,"observed_ci_run_id":25161542044,"observed_ci_run_count":5},"status":"keep","description":"Install a matching system wasm-bindgen in the web job so Trunk can use PATH discovery instead of downloading wasm-bindgen into its ephemeral tool cache during trunk build.","timestamp":1777547008018,"segment":4,"confidence":7.287940714125309,"asi":{"hypothesis":"If the web job installs the exact wasm-bindgen version required by the app, Trunk should find that system binary on PATH and skip its per-run download/install path, shortening the web critical path on ephemeral CI runners.","root_cause_evidence":"Trunk's tool resolver first calls `find_system(Application::WasmBindgen)` and only downloads into `~/.cache/trunk` if no matching system version is found. Local cold-cache measurements showed `trunk build` dropping from ~2.86s without a system tool to ~1.40s when a matching `wasm-bindgen` binary was present on PATH.","changed_files":[".github/workflows/ci.yml","autoresearch.sh"],"workflow_strategy":"keep the current warmed static-dist topology, but preinstall `wasm-bindgen@0.2.106` in the web job via `taiki-e/install-action@v2` before `trunk build`","benchmark_caveat":"This improvement is still proxy-backed, so real CI must confirm that the extra install step is cheaper than Trunk's current download/install path on GitHub-hosted runners.","rollback_reason":"","next_action_hint":"Push and validate on real CI; if `Web trunk build` or overall `web` drops below the current best (`web=85s`, run 25161542044), keep it. If not, revert and treat the remaining wasm-bindgen overhead as not worth additional workflow complexity."}}
{"run":27,"commit":"0000000","metric":28.859,"metrics":{"web_local_s":1.351,"web_trunk_build_s":1.411,"web_trunk_build_cold_s":3.513,"web_trunk_build_cold_system_wasm_bindgen_s":1.394,"mcp_local_s":1.253,"tui_local_s":6.859,"modeled_jobs":3,"modeled_unknown_steps":0,"observed_ci_run_id":25161888248,"observed_ci_run_count":5},"status":"discard","description":"Tried replacing the system wasm-bindgen install with an explicit GitHub Actions cache for Trunk’s ~/.cache/trunk tools directory in the web job.","timestamp":1777547548864,"segment":4,"confidence":12.878253968253967,"asi":{"hypothesis":"Because Trunk stores downloaded wasm-bindgen binaries under ~/.cache/trunk, restoring that directory early in the web job might preserve the same cold-run savings as a system wasm-bindgen install while avoiding an explicit extra tool install step.","root_cause_evidence":"The improved proxy can now distinguish no-system cold trunk builds (~3.51s) from warmed/cached tool builds (~1.41s), and the current install-wasm-bindgen branch showed that shaving trunk-build setup alone is not enough if the rest of the web job does not also improve.","rollback_reason":"Even under the improved trunk model this candidate projected worse on top of the latest branch evidence, so it is not a strong enough follow-up to justify another real CI run right now.","next_action_hint":"Return to the current branch state, then either explicitly unwind the unproven system-wasm-bindgen change or pursue a different web-lane bottleneck with a clearer projected win."}}
{"run":28,"commit":"0000000","metric":28.871,"metrics":{"web_local_s":1.363,"web_trunk_build_s":1.389,"web_trunk_build_cold_s":3.347,"web_trunk_build_cold_system_wasm_bindgen_s":1.401,"mcp_local_s":1.274,"tui_local_s":6.871,"modeled_jobs":3,"modeled_unknown_steps":0,"observed_ci_run_id":25161888248,"observed_ci_run_count":5},"status":"discard","description":"Tried reverting the CI-only Playwright worker cap from 6 back to 4 while keeping the current branch workflow otherwise unchanged.","timestamp":1777547909615,"segment":4,"confidence":14.647589817656621,"asi":{"hypothesis":"The best actual run with 6 workers only barely beat earlier 4-worker evidence on the legacy step, so returning to 4 workers might reduce browser startup overhead on GitHub-hosted runners while preserving the current workflow shape.","root_cause_evidence":"Local CI-like legacy runs still show 6 workers slightly faster than 4 workers, and with the current branch evidence anchored on run 25161888248 the proxy no longer sees a convincing case for rolling back to 4 workers.","verification":"Changed the config test to require 4 CI workers, observed the test fail first, updated the Playwright config, reran the targeted config tests, reran `pnpm -C apps/egui-web run test:preflight`, and reran a CI-like external-server legacy Playwright suite; all passed.","rollback_reason":"Under the current benchmark and latest branch evidence this regressed materially, so there is not enough signal to justify another real CI run for the 4-worker rollback in isolation.","next_action_hint":"Restore the validated 6-worker setting and improve the proxy so it can compare candidate workflows against matching historical CI runs rather than only the latest branch run."}}
