{"run":38,"commit":"817519d","metric":49.5,"metrics":{"web_local_s":8.577,"web_trunk_build_s":1.422,"web_trunk_build_cold_s":15.025,"web_trunk_build_cold_system_wasm_bindgen_s":1.433,"mcp_local_s":1.373,"tui_local_s":6.764,"modeled_jobs":6,"modeled_unknown_steps":0,"observed_ci_run_id":25198110827,"observed_ci_run_count":5,"observed_ci_selection_tier":0,"observed_ci_matching_run_count":0,"observed_ci_exact_runtime_run_count":0,"observed_ci_exact_run_runtime_count":3,"observed_ci_view_failure_count":0},"status":"keep","description":"Fan out BDD and legacy static web suites from an artifact while preserving the Rust build in the existing `web` job name.","timestamp":1777600345897,"segment":2,"confidence":8.491619047619048,"asi":{"hypothesis":"The previous artifact+shard topology failed largely because it renamed the compile-heavy job to `web-build`, causing a Rust cache miss and a 68s trunk build. Keeping the build in the existing `web` job while uploading dist to downstream `web-bdd` and `web-legacy` jobs should preserve cache behavior and overlap the BDD/legacy browser suites without duplicating compilation.","root_cause_evidence":"The validated baseline `web` job already gets a fast cached `Web trunk build` (~5s in real run 25198110827). This candidate keeps that job name and all setup/build steps, then replaces serial BDD+legacy steps with artifact upload plus downstream static-server jobs. The proxy reports zero unknown steps and a much smaller 6-job critical path than the stale renamed `web-build` artifact run, though it is still fallback-tier because no matching workflow exists yet.","verification":"Added a failing CI workflow test first, made it pass with `web` artifact upload plus `web-bdd`/`web-legacy` jobs depending on `web`, verified the workflow parses with Python YAML, ran `node --test test-node/ci-workflow.test.cjs`, and ran `./autoresearch.sh` successfully.","benchmark_caveat":"Metric 49.5 is fallback-tier (`observed_ci_selection_tier=0`) and likely optimistic for downstream job startup/artifact overhead. The hypothesis specifically depends on real CI preserving the `web` job Rust cache behavior, so a real GitHub Actions run is mandatory before accepting the topology.","changed_files":[".github/workflows/ci.yml","test-node/ci-workflow.test.cjs","autoresearch.ideas.md"],"next_action_hint":"Push this candidate to PR/CI. Keep only if real wall time beats the current 73–76.5s split-preflight baseline; otherwise revert and mark even job-name-preserving artifact fan-out as too expensive."}}
{"run":39,"commit":"445dd1f","metric":87,"metrics":{"web_local_s":8.56,"web_trunk_build_s":1.385,"web_trunk_build_cold_s":4.643,"web_trunk_build_cold_system_wasm_bindgen_s":1.391,"mcp_local_s":1.405,"tui_local_s":6.427,"modeled_jobs":4,"modeled_unknown_steps":0,"observed_ci_run_id":25198110827,"observed_ci_run_count":5,"observed_ci_selection_tier":1,"observed_ci_matching_run_count":7,"observed_ci_exact_runtime_run_count":0,"observed_ci_exact_run_runtime_count":4,"observed_ci_view_failure_count":0},"status":"keep","description":"Revert the job-name-preserving artifact fan-out after real CI showed downstream job overhead made it slower than split-preflight.","timestamp":1777600645701,"segment":2,"confidence":8.105636363636364,"asi":{"hypothesis":"The job-name-preserving artifact fan-out should be reverted because real CI shows the downstream BDD/legacy job startup and artifact overhead outweigh the serial BDD+legacy savings.","root_cause_evidence":"Real CI run 25198506199 on 817519d succeeded but took about 98s wall clock: `web=35s`, then downstream `web-bdd=28s` and `web-legacy=53s`. Even though preserving the `web` job avoided the previous 68s renamed-job trunk build miss, the `web -> web-legacy` critical path was still ~88s plus scheduling, worse than the current split-preflight real run 25198110827 with `web=73s`.","verification":"Restored `.github/workflows/ci.yml` and `test-node/ci-workflow.test.cjs` to the split-preflight topology, updated the ideas backlog to mark job-name-preserving artifact fan-out stale, ran root `node --test test-node/*.test.cjs`, verified the workflow parses back to 4 jobs, and reran `./autoresearch.sh` successfully.","benchmark_note":"The revert was measured while dirty, so it reports selection tier 1 and projected_ci_s=87. A clean rerun after this commit should return to the exact 76.5s baseline; this keep is justified by real CI evidence and by restoring the validated topology, not by the dirty-worktree proxy value.","changed_files":[".github/workflows/ci.yml","test-node/ci-workflow.test.cjs","autoresearch.ideas.md"],"next_action_hint":"Run a clean control benchmark after the revert commit. Then prioritize benchmark-quality modeling for new downstream Node job overhead before trying any more fan-out topology."}}
{"run":40,"commit":"0000000","metric":76.5,"metrics":{"web_local_s":8.587,"web_trunk_build_s":1.408,"web_trunk_build_cold_s":4.051,"web_trunk_build_cold_system_wasm_bindgen_s":1.407,"mcp_local_s":1.326,"tui_local_s":6.756,"modeled_jobs":4,"modeled_unknown_steps":0,"observed_ci_run_id":25198110827,"observed_ci_run_count":2,"observed_ci_selection_tier":2,"observed_ci_matching_run_count":7,"observed_ci_exact_runtime_run_count":2,"observed_ci_exact_run_runtime_count":4,"observed_ci_view_failure_count":0},"status":"discard","description":"Clean control rerun after reverting job-name-preserving artifact fan-out; confirmed split-preflight exact baseline is restored.","timestamp":1777600766502,"segment":2,"confidence":8.491619047619048,"asi":{"hypothesis":"The clean post-revert branch should re-anchor exactly on the validated split-preflight baseline after discarding both artifact fan-out variants.","root_cause_evidence":"The clean rerun selected real CI run 25198110827 at selection tier 2 with two exact-runtime matching runs and projected_ci_s=76.5, confirming the split-preflight baseline is restored after the revert commit.","rollback_reason":"This was a control run with no intended code change; metric equals the current baseline, so no new code should be kept.","next_action_hint":"Continue from 76.5s baseline. Do not retry artifact fan-out topology without first adding a benchmark model for downstream Node job startup/artifact overhead."}}
{"run":41,"commit":"7155768","metric":79,"metrics":{"web_local_s":8.519,"web_trunk_build_s":1.402,"web_trunk_build_cold_s":6.689,"web_trunk_build_cold_system_wasm_bindgen_s":1.367,"mcp_local_s":1.389,"tui_local_s":6.751,"modeled_jobs":4,"modeled_unknown_steps":0,"observed_ci_run_id":25198693342,"observed_ci_run_count":3,"observed_ci_selection_tier":2,"observed_ci_matching_run_count":8,"observed_ci_exact_runtime_run_count":3,"observed_ci_exact_run_runtime_count":5,"observed_ci_view_failure_count":0},"status":"keep","description":"Model fallback-tier run steps with observed same-step CI costs so new fan-out jobs cannot borrow unrealistically fast local browser-suite timings.","timestamp":1777601007588,"segment":2,"confidence":14.860333333333335,"asi":{"hypothesis":"Fallback-tier topology models should not use raw local timings for run steps such as BDD or legacy Playwright when recent CI has observed the same step name taking much longer. Using `max(observed same-step CI cost, local run cost)` should prevent future artifact/fan-out candidates from projecting fake wins.","root_cause_evidence":"Both artifact fan-out experiments were badly over-optimistic because new downstream jobs modeled `Web Playwright legacy (static dist)` from local ~4s timings while real CI showed the same step at ~43s. The already-existing workflow-only tier had a conservative max rule; fallback tier lacked the same protection.","benchmark_change":"For `observed_ci_selection_tier == 0`, if a modeled run step has an observed same-step CI duration, the proxy now uses `max(fallback_observed_step_cost, run_cost)` instead of raw local `run_cost`. Exact-runtime matches and workflow-only job+step matches still take precedence.","verification":"Added a failing source test for fallback-tier observed same-step costs, made it pass, ran `bash -n autoresearch.sh`, `node --test test-node/autoresearch-script.test.cjs`, and reran `./autoresearch.sh` successfully with zero unknown steps.","metric_note":"The clean split-preflight metric is now 79 because a newer exact CI run 25198693342 entered the observed set; the benchmark change is primarily an integrity fix for future fallback-tier topology candidates, not a product runtime win.","changed_files":["autoresearch.sh","test-node/autoresearch-script.test.cjs"],"next_action_hint":"Use this stricter proxy before trying any more topology changes. Re-test only ideas whose projected win survives observed same-step browser-suite costs."}}
{"run":42,"commit":"74bf71f","metric":80.71,"metrics":{"web_local_s":8.397,"web_trunk_build_s":1.344,"web_trunk_build_cold_s":7.961,"web_trunk_build_cold_system_wasm_bindgen_s":1.347,"web_static_suites_s":7.301,"mcp_local_s":1.356,"tui_local_s":6.331,"modeled_jobs":4,"modeled_unknown_steps":0,"observed_ci_run_id":25198795807,"observed_ci_run_count":5,"observed_ci_selection_tier":0,"observed_ci_matching_run_count":0,"observed_ci_exact_runtime_run_count":0,"observed_ci_exact_run_runtime_count":6,"observed_ci_view_failure_count":0},"status":"keep","description":"Run the web BDD and legacy Playwright suites behind one shared static server in the `web` job while keeping both validation commands.","timestamp":1777601679009,"segment":2,"confidence":13.287928464977687,"asi":{"hypothesis":"Starting the static `dist/` server once and running both web BDD and legacy Playwright commands against it should remove duplicate server startup/readiness overhead without dropping either validation suite.","implementation":"Replaced the two static web test steps in the `web` job with one `Web static BDD and legacy suites` step that starts one Python static server, performs one readiness poll, then runs `pnpm run test:bdd` followed by `pnpm run test:pw-legacy`. Added a local `WEB_STATIC_SUITES_S` benchmark and a conservative model that applies the local shared-server delta to observed CI BDD+legacy costs instead of trusting local absolute browser timings.","verification":"Added failing workflow and autoresearch source tests first, made them pass, ran `bash -n autoresearch.sh`, `node --test test-node/*.test.cjs`, YAML parsed the workflow, and reran `./autoresearch.sh` successfully with zero unknown modeled steps.","benchmark_note":"This is still a topology/runtime hypothesis with selection tier 0 and no matching workflow CI run yet. The proxy is deliberately conservative (`projected_ci_s=80.71`) and real CI must decide whether the shared server saves time or merely hides step-level reporting.","coverage_note":"Both Web BDD and Web legacy Playwright commands still run in CI; only the duplicated static server lifecycle changed.","changed_files":[".github/workflows/ci.yml","autoresearch.sh","test-node/autoresearch-script.test.cjs","test-node/ci-workflow.test.cjs"],"next_action_hint":"Push and wait for the GitHub Actions run for this commit. If the real `web` job is not faster than the current 79-81s split-preflight web baseline, revert this shared-server candidate."}}
{"run":43,"commit":"42bad5a","metric":81,"metrics":{"web_local_s":8.436,"web_trunk_build_s":1.313,"web_trunk_build_cold_s":3.385,"web_trunk_build_cold_system_wasm_bindgen_s":1.361,"web_static_suites_s":0,"mcp_local_s":1.334,"tui_local_s":6.773,"modeled_jobs":4,"modeled_unknown_steps":0,"observed_ci_run_id":25198795807,"observed_ci_run_count":5,"observed_ci_selection_tier":1,"observed_ci_matching_run_count":9,"observed_ci_exact_runtime_run_count":0,"observed_ci_exact_run_runtime_count":7,"observed_ci_view_failure_count":0},"status":"keep","description":"Revert the shared-static-server web step after real CI showed it did not improve the web job.","timestamp":1777601958283,"segment":2,"confidence":10.589311163895504,"asi":{"hypothesis":"The shared-server candidate should be reverted because real CI showed no reduction in the `web` critical path and slightly worse suite-step accounting.","root_cause_evidence":"Real CI run 25199074002 on 74bf71f succeeded but the `web` job still took 81s. Its single `Web static BDD and legacy suites` step took 55s, whereas the prior exact run 25198795807 had separate BDD and legacy steps of 13s + 41s = 54s with the same total web job duration of 81s.","verification":"Restored `.github/workflows/ci.yml`, `autoresearch.sh`, and the node tests to the pre-candidate split-step topology, marked the shared-server lane stale in `autoresearch.ideas.md`, ran `bash -n autoresearch.sh`, `node --test test-node/*.test.cjs`, parsed the workflow back to separate BDD and legacy steps, and reran `./autoresearch.sh` successfully.","benchmark_note":"The measured revert is selection tier 1 because the workflow file is dirty relative to the candidate commit during the revert; after this commit and push, the clean branch should exact-match the split-step workflow again. The retired `web_static_suites_s` secondary is recorded as 0 because the reverted benchmark no longer emits it.","changed_files":[".github/workflows/ci.yml","autoresearch.sh","test-node/autoresearch-script.test.cjs","test-node/ci-workflow.test.cjs","autoresearch.ideas.md"],"next_action_hint":"Continue from the split-step web baseline around 81s. Avoid further static-server lifecycle topology unless CI evidence indicates non-zero server overhead; focus next on legacy Playwright test/runtime bottlenecks that preserve validation."}}
{"run":44,"commit":"0000000","metric":79,"metrics":{"web_local_s":8.35,"web_trunk_build_s":1.344,"web_trunk_build_cold_s":10.056,"web_trunk_build_cold_system_wasm_bindgen_s":1.362,"web_static_suites_s":0,"mcp_local_s":1.326,"tui_local_s":6.735,"modeled_jobs":4,"modeled_unknown_steps":0,"observed_ci_run_id":25199184620,"observed_ci_run_count":5,"observed_ci_selection_tier":2,"observed_ci_matching_run_count":10,"observed_ci_exact_runtime_run_count":5,"observed_ci_exact_run_runtime_count":8,"observed_ci_view_failure_count":0},"status":"discard","description":"Clean control after reverting the shared-server candidate; exact matching confirms the split-step web baseline is back around 79s.","timestamp":1777602202466,"segment":2,"confidence":13.287928464977687,"asi":{"hypothesis":"The clean branch after reverting the shared-server candidate should return to exact workflow/runtime matching and the validated split-step web baseline.","root_cause_evidence":"The control run selected real CI run 25199184620 at selection tier 2 with five exact-runtime matching runs and projected_ci_s=79. The latest run had `web=84s`, but the median exact set still anchors the proxy at 79s.","rollback_reason":"This was a control-only run with no intended source changes after the revert commit, so there is nothing new to keep.","next_action_hint":"Continue from the 79s exact baseline. Treat `web_static_suites_s=0` as a retired secondary metric required only because it was tracked in the reverted candidate."}}
{"run":45,"commit":"c723232","metric":76.332,"metrics":{"web_local_s":8.271,"web_trunk_build_s":1.338,"web_trunk_build_cold_s":7.332,"web_trunk_build_cold_system_wasm_bindgen_s":1.363,"web_static_suites_s":0,"mcp_local_s":1.273,"tui_local_s":6.736,"modeled_jobs":4,"modeled_unknown_steps":0,"observed_ci_run_id":25199184620,"observed_ci_run_count":5,"observed_ci_selection_tier":1,"observed_ci_matching_run_count":10,"observed_ci_exact_runtime_run_count":0,"observed_ci_exact_run_runtime_count":0,"observed_ci_view_failure_count":0},"status":"keep","description":"Replace fixed 50ms drag-settling sleeps in web tests with frame-based paint waits to reduce legacy Playwright idle time without weakening assertions.","timestamp":1777602475278,"segment":2,"confidence":16.70952023988002,"asi":{"hypothesis":"The 11 fixed 50ms post-drag waits in BDD/legacy web tests can be replaced by waiting for browser animation frames. This preserves the intent of letting egui paint the drag preview while removing arbitrary idle time from the slow Playwright lane.","implementation":"Added `waitForAnimationFrames(page, count=2)` to the shared egui helper module, replaced the raw 50ms waits in the legacy Playwright suite and drag-preview Cucumber step, and added source/unit tests that require frame-based settling.","verification":"Ran `pnpm -C apps/egui-web run test:preflight`, then ran CI-like external-server `pnpm run test:bdd` and `pnpm run test:pw-legacy`; both passed. Reran `./autoresearch.sh` successfully with zero unknown modeled steps.","benchmark_note":"This candidate modifies runtime test code, so the proxy is workflow-match tier 1 with no exact runtime CI match yet. The apparent improvement to 76.332s is promising but must be validated by the GitHub Actions run for this commit before accepting the speedup as real.","coverage_note":"No tests or assertions were removed; the replacement waits for actual browser paint frames instead of a fixed sleep.","changed_files":["apps/egui-web/features/support/egui-helpers.cjs","apps/egui-web/features/step_definitions/drag-preview-z-order.steps.cjs","apps/egui-web/tests/egui-web.spec.js","apps/egui-web/test-node/egui-helpers.test.cjs","apps/egui-web/test-node/legacy-playwright-suite.test.cjs"],"next_action_hint":"Push the candidate and compare the next real CI web/BDD/legacy timings against the 79s exact baseline. Revert if flakiness appears or the web job is not faster."}}
{"run":46,"commit":"0000000","metric":87,"metrics":{"web_local_s":8.205,"web_trunk_build_s":1.336,"web_trunk_build_cold_s":9.908,"web_trunk_build_cold_system_wasm_bindgen_s":1.301,"web_static_suites_s":0,"mcp_local_s":1.385,"tui_local_s":6.307,"modeled_jobs":4,"modeled_unknown_steps":0,"observed_ci_run_id":25199398047,"observed_ci_run_count":1,"observed_ci_selection_tier":2,"observed_ci_matching_run_count":11,"observed_ci_exact_runtime_run_count":1,"observed_ci_exact_run_runtime_count":1,"observed_ci_view_failure_count":0},"status":"discard","description":"Exact real-CI rerun for the frame-based drag wait candidate showed the web job got slower, not faster.","timestamp":1777602730236,"segment":2,"confidence":13.287928464977687,"asi":{"hypothesis":"The frame-based paint waits should make drag-preview tests faster than fixed 50ms sleeps, but exact CI evidence must decide.","root_cause_evidence":"Real CI run 25199398047 on c723232 succeeded but projected_ci_s rose to 87 with exact selection tier 2. The `web` job took 89s, with BDD 12s and legacy Playwright 48s, worse than recent split-step baselines around 79-84s and worse than the immediate pre-candidate legacy step of 45s.","rollback_reason":"The candidate did not produce a real CI runtime win and may have made the drag-preview lane wait for slower paint scheduling on GitHub's software WebGPU runner.","next_action_hint":"Revert the frame-based wait candidate. If wait tuning is revisited, collect CI per-test timing first and avoid replacing the current fixed settle unless real CI demonstrates a reduction."}}
{"run":47,"commit":"65560c6","metric":76,"metrics":{"web_local_s":8.434,"web_trunk_build_s":1.346,"web_trunk_build_cold_s":5.96,"web_trunk_build_cold_system_wasm_bindgen_s":1.365,"web_static_suites_s":0,"mcp_local_s":1.335,"tui_local_s":6.717,"modeled_jobs":4,"modeled_unknown_steps":0,"observed_ci_run_id":25199398047,"observed_ci_run_count":5,"observed_ci_selection_tier":1,"observed_ci_matching_run_count":11,"observed_ci_exact_runtime_run_count":0,"observed_ci_exact_run_runtime_count":0,"observed_ci_view_failure_count":0},"status":"keep","description":"Revert the frame-based drag wait candidate after exact CI showed it slowed the web job.","timestamp":1777602868423,"segment":2,"confidence":14.860333333333335,"asi":{"hypothesis":"Reverting the frame-based drag wait candidate should restore the fixed 50ms settle behavior because exact CI showed the replacement was slower on GitHub's software WebGPU runner.","root_cause_evidence":"Exact candidate run 25199398047 selected tier 2 and projected 87s, with `web=89s`, BDD 12s, and legacy 48s. That is worse than the split-step baseline exact proxy around 79s and the latest reverted baseline run's web=84s.","verification":"Restored all files touched by c723232, updated `autoresearch.ideas.md` to mark frame-based waits stale, ran `pnpm -C apps/egui-web run test:preflight`, and reran `./autoresearch.sh` successfully.","benchmark_note":"The revert run is workflow-match tier 1 while runtime files are dirty relative to the candidate commit. Push and allow the revert CI run to recreate exact-match evidence before trusting subsequent runtime candidates.","changed_files":["apps/egui-web/features/support/egui-helpers.cjs","apps/egui-web/features/step_definitions/drag-preview-z-order.steps.cjs","apps/egui-web/tests/egui-web.spec.js","apps/egui-web/test-node/egui-helpers.test.cjs","apps/egui-web/test-node/legacy-playwright-suite.test.cjs","autoresearch.ideas.md"],"next_action_hint":"Push the revert. Next, prefer adding CI per-test timing observability over more local-only wait/screenshot micro-tuning."}}
