{"run":60,"commit":"0000000","metric":0,"metrics":{"web_local_s":7.704,"web_trunk_build_s":1.344,"web_trunk_build_cold_s":4.319,"web_trunk_build_cold_system_wasm_bindgen_s":1.358,"mcp_local_s":1.212,"tui_local_s":6.485,"modeled_jobs":4,"modeled_unknown_steps":0,"observed_ci_run_id":25168767233,"observed_ci_run_count":3},"status":"crash","description":"Retried removing success-only screenshot file writes from the legacy Playwright hot path after reapplying the tiny change and re-verifying preflight/tests.","timestamp":1777557979229,"segment":4,"confidence":11.732899493853942,"asi":{"hypothesis":"The first legacy WebGPU rendering test still does three success-only PNG file writes; removing them might shave a small amount from the `Web Playwright legacy (static dist)` step without changing assertions or coverage.","root_cause_evidence":"The focused one-test benchmark again suggested only a tiny local improvement (~`2.72s` → ~`2.69s` median), which already looked close to noise. After reapplying the change and rerunning the test-first verification, the full `./autoresearch.sh` attempt crashed in the same repeated legacy benchmark path a second time before producing a projected metric.","verification_before_crash":"Observed the unit test fail first, re-applied the screenshot-write removal, reran the targeted unit test, reran `pnpm -C apps/egui-web run test:preflight`, and reran one full CI-like `pnpm run test:pw-legacy` pass successfully before the second benchmark attempt.","rollback_reason":"Two consecutive benchmark crashes plus only a tiny isolated-test delta make this lane too small and noisy to justify more loop time right now.","next_action_hint":"Prune success-only screenshot-write removal from the ideas backlog as low-signal. Shift to a different hypothesis or benchmark-harness improvement with clearer upside than sub-50ms legacy micro-tuning.","failure_detail":"The second `run_experiment` attempt failed in the repeated local `pnpm run test:pw-legacy` benchmark again, with no deterministic failure evidence pointing at the screenshot-write removal itself."}}
{"run":61,"commit":"0000000","metric":0,"metrics":{"web_local_s":7.704,"web_trunk_build_s":1.344,"web_trunk_build_cold_s":4.319,"web_trunk_build_cold_system_wasm_bindgen_s":1.358,"mcp_local_s":1.212,"tui_local_s":6.485,"modeled_jobs":4,"modeled_unknown_steps":0,"observed_ci_run_id":25168767233,"observed_ci_run_count":3},"status":"crash","description":"Tried declaring an inline `data:,` favicon in `apps/egui-web/index.html` so browser test runs stop issuing repeated `/favicon.ico` 404 requests.","timestamp":1777558201254,"segment":4,"confidence":11.732899493853942,"asi":{"hypothesis":"Each web test page load currently triggers a useless `/favicon.ico` request that returns 404. Declaring a tiny inline favicon in `index.html` should remove that extra request noise across both BDD and legacy suites without changing validation coverage.","root_cause_evidence":"After adding the inline favicon, the new test passed and a full CI-like `pnpm run test:pw-legacy` verification confirmed `favicon404 False` in the captured static-server log. The candidate therefore removed the repeated 404s as intended. However the full `./autoresearch.sh` attempt still crashed in the existing flaky repeated legacy benchmark path before a projected metric was emitted.","verification_before_crash":"Observed the new `index-html.test.cjs` fail first, added `<link rel=\"icon\" href=\"data:,\" />` to `apps/egui-web/index.html`, reran the targeted test and full `pnpm -C apps/egui-web run test:preflight`, then ran one CI-like full legacy suite and confirmed no `/favicon.ico` requests appeared in the server log.","rollback_reason":"Cannot judge the runtime value of the favicon change from this attempt because the benchmark harness crashed before producing metrics.","next_action_hint":"Given three consecutive candidate experiments have all been blocked by the same repeated legacy benchmark flake, shift to a benchmark-robustness hypothesis next (for example bounded retry / successful-sample collection for the repeated legacy measurement) before spending more time on additional micro-optimizations.","failure_detail":"`run_experiment` failed again inside the repeated local `pnpm run test:pw-legacy` benchmark command, so this run does not say whether removing favicon 404s helps `projected_ci_s`."}}
{"run":62,"commit":"0000000","metric":465.348,"metrics":{"web_local_s":7.776,"web_trunk_build_s":1.339,"web_trunk_build_cold_s":3.881,"web_trunk_build_cold_system_wasm_bindgen_s":1.353,"mcp_local_s":1.39,"tui_local_s":6.348,"modeled_jobs":4,"modeled_unknown_steps":0,"observed_ci_run_id":0,"observed_ci_run_count":0},"status":"discard","description":"Tried two changes together: add bounded extra-attempt collection for flaky local median benchmarks in `autoresearch.sh`, and declare an inline favicon in `apps/egui-web/index.html` so browser tests stop issuing `/favicon.ico` 404s.","timestamp":1777558416161,"segment":4,"confidence":11.355213435969212,"asi":{"hypothesis":"The loop is currently bottlenecked by transient repeated `test:pw-legacy` failures, so bounded retry/success-sample collection in `measure_median_seconds` should let runtime candidates complete more often without biasing the metric too much. Pairing that robustness fix with an inline favicon should also remove repeated `/favicon.ico` 404 noise from every web page load.","root_cause_evidence":"The combined candidate finally let `./autoresearch.sh` finish instead of crashing in the flaky repeated legacy measurement. The inline favicon also worked functionally: targeted verification confirmed the static-server log no longer contained `/favicon.ico` requests during a CI-like full legacy run. However the projected metric blew up to `465.348s` and the selector reported `observed_ci_run_id=0`, `observed_ci_run_count=0`, meaning this combined dirty runtime + benchmark-harness branch fell off the observed-run anchoring path entirely and is not a competitive next state.","verification":"Added a failing `index-html.test.cjs`, made it pass with `<link rel=\"icon\" href=\"data:,\" />`, ran `bash -n autoresearch.sh`, reran the targeted favicon test and `pnpm -C apps/egui-web run test:preflight`, then ran `./autoresearch.sh` successfully with the bounded-attempt median sampler in place.","rollback_reason":"Even though the robustness tweak let the benchmark complete, the combined candidate is far worse under the current proxy because it loses the observed-run baseline and does not show a believable CI improvement.","next_action_hint":"Keep the screenshot-write and favicon micro-tuning lanes pruned. The next useful step is to inspect why this candidate lost all observed-run anchoring (`observed_ci_run_id=0`) and decide whether that is a genuine conservative benchmark outcome for runtime-dirty candidates or another benchmark-quality gap worth fixing before more runtime micro-optimizations.","changes_tried":["autoresearch.sh","apps/egui-web/index.html","apps/egui-web/test-node/index-html.test.cjs"]}}
{"run":63,"commit":"0000000","metric":84,"metrics":{"web_local_s":7.835,"web_trunk_build_s":1.344,"web_trunk_build_cold_s":2.937,"web_trunk_build_cold_system_wasm_bindgen_s":1.344,"mcp_local_s":1.415,"tui_local_s":6.751,"modeled_jobs":4,"modeled_unknown_steps":0,"observed_ci_run_id":25169323225,"observed_ci_run_count":4},"status":"discard","description":"Tried making `measure_median_seconds` collect up to two extra attempts so flaky local benchmark commands can still contribute three successful samples instead of crashing the whole run on the first transient failure.","timestamp":1777558589706,"segment":4,"confidence":11.201573933452991,"asi":{"hypothesis":"The repeated local `test:pw-legacy` measurement has become the main loop blocker. Letting the median sampler use a bounded number of extra attempts to gather the intended three successful samples should improve loop robustness without meaningfully biasing the projected CI metric.","root_cause_evidence":"This tweak did exactly what it was meant to do operationally: after several crash-only candidate attempts, `./autoresearch.sh` completed successfully again on the current branch. However the resulting projected metric landed at `84s`, which is worse than the current `~80s` split-preflight baseline with per-job overhead modeling, so the robustness gain does not justify treating this as the new benchmark state yet.","benchmark_change":"`measure_median_seconds` now allows up to `repeats + 2` total attempts and computes the median from the first `repeats` successful samples. Persistent failures still abort the run.","verification":"Ran `bash -n autoresearch.sh` and then reran `./autoresearch.sh` successfully on the restored split-preflight branch with no product/runtime changes. The benchmark no longer crashed, and it anchored on successful run `25169323225` with `observed_ci_run_count=4`.","rollback_reason":"Although this made the loop more resilient, it regressed the projected CI metric versus the current benchmark baseline (`~80s` → `84s`). Keep it only as a research note for now, not as the new benchmark policy.","next_action_hint":"Investigate why the robustness tweak shifts the anchored projected metric upward before adopting it. In parallel, treat the legacy-step micro-tuning lanes as pruned and focus on the newly observed anchoring/conservatism behavior for runtime-dirty candidates.","changed_files":["autoresearch.sh"]}}
{"run":64,"commit":"0000000","metric":84,"metrics":{"web_local_s":7.855,"web_trunk_build_s":1.382,"web_trunk_build_cold_s":3.017,"web_trunk_build_cold_system_wasm_bindgen_s":1.387,"mcp_local_s":1.414,"tui_local_s":6.775,"modeled_jobs":4,"modeled_unknown_steps":0,"observed_ci_run_id":25169323225,"observed_ci_run_count":4},"status":"discard","description":"Control rerun: reverted the bounded extra-attempt sampler tweak and reran the current split-preflight proxy against the updated exact successful CI run set.","timestamp":1777558912866,"segment":4,"confidence":10.649471680777054,"asi":{"hypothesis":"The earlier `84s` result from the bounded extra-attempt sampler might have been caused by the new sampler itself rather than by the branch’s observed exact CI run set drifting upward.","root_cause_evidence":"After restoring `measure_median_seconds` to the pre-retry version and rerunning `./autoresearch.sh`, the proxy still landed at `84s` with the same anchor (`observed_ci_run_id=25169323225`, `observed_ci_run_count=4`). That shows the earlier `84s` shift was not introduced by the bounded-attempt logic; it came from the updated exact matching CI evidence now available on the branch.","benchmark_learning":"The current honest split-preflight baseline has effectively moved from the earlier `~80s` figure to about `84s` because the exact matching successful run set now includes run `25169323225` on `70e77db`. Future benchmark-quality changes should compare against that newer anchor, not the older 3-run set.","rollback_reason":"This was a control/diagnostic rerun, not a winning code change. It proves the bounded extra-attempt sampler was not the cause of the higher projected baseline, so there is no reason to keep or discard the sampler based on the earlier `84s` vs `80s` delta alone.","next_action_hint":"Treat `84s` as the current proxy baseline for the validated split-preflight branch. Reassess whether bounded retry for flaky local sampling is worth keeping on robustness grounds alone, or move to a different benchmark-quality or real CI bottleneck hypothesis.","changed_files":[]}}
{"run":65,"commit":"3123efc","metric":84,"metrics":{"web_local_s":7.758,"web_trunk_build_s":1.345,"web_trunk_build_cold_s":3.155,"web_trunk_build_cold_system_wasm_bindgen_s":1.34,"mcp_local_s":1.266,"tui_local_s":6.325,"modeled_jobs":4,"modeled_unknown_steps":0,"observed_ci_run_id":25169323225,"observed_ci_run_count":4},"status":"keep","description":"Make the median sampler tolerant of one or two transient local benchmark failures by collecting three successful samples within up to five total attempts.","timestamp":1777559066182,"segment":4,"confidence":10.443171579353839,"asi":{"hypothesis":"The repeated local `test:pw-legacy` measurement is currently the main blocker for continuing the loop. Allowing `measure_median_seconds` to gather the intended three successful samples across up to two extra retries should improve loop robustness without materially biasing the projected CI metric.","root_cause_evidence":"A control rerun immediately beforehand showed that the current exact successful run set has already moved the honest split-preflight proxy baseline to about `84s` even without the retry logic. Reapplying the bounded-attempt sampler kept the proxy at the same `84s` anchor (`observed_ci_run_id=25169323225`, `observed_ci_run_count=4`) while restoring the operational benefit that the full benchmark can survive occasional single-sample legacy flakes.","benchmark_change":"`measure_median_seconds` now allows up to `repeats + 2` total attempts and computes the median from the first `repeats` successful samples. It still fails hard if it cannot collect three successes, so persistent regressions are not hidden.","verification":"Ran `bash -n autoresearch.sh`, performed a control rerun without the retry logic to prove the new `84s` baseline came from the updated observed CI evidence rather than the sampler tweak, then re-applied the bounded-attempt logic and reran `./autoresearch.sh` successfully. The projected metric remained `84s`, confirming the robustness improvement is effectively neutral on the modeled CI baseline.","rollback_reason":"","next_action_hint":"Use this more resilient benchmark loop for the next hypothesis. The next promising lane is no longer tiny legacy micro-tuning; it is either a higher-signal legacy-step optimization or another benchmark-quality improvement that can beat or clarify the current `~84s` split-preflight proxy baseline.","changed_files":["autoresearch.sh"]}}
{"run":66,"commit":"133f063","metric":84,"metrics":{"web_local_s":7.812,"web_trunk_build_s":1.377,"web_trunk_build_cold_s":3.468,"web_trunk_build_cold_system_wasm_bindgen_s":1.389,"mcp_local_s":1.225,"tui_local_s":6.728,"modeled_jobs":4,"modeled_unknown_steps":0,"observed_ci_run_id":25169323225,"observed_ci_run_count":4,"observed_ci_selection_tier":2,"observed_ci_matching_run_count":4,"observed_ci_exact_runtime_run_count":4,"observed_ci_exact_run_runtime_count":12,"observed_ci_view_failure_count":0},"status":"keep","description":"Add explicit CI observation diagnostics to the proxy so anomalous `observed_ci_run_id=0` results can be distinguished between true fallback selection and GH run-view collection failures.","timestamp":1777559567712,"segment":4,"confidence":10.294106451817546,"asi":{"hypothesis":"The `observed_ci_run_id=0` anomaly may have been a transient GH observation failure rather than a meaningful conservative fallback. Emitting explicit diagnostics for selection tier, matching counts, exact-runtime counts, and run-view failures should make future anomalies interpretable without changing the modeled CI runtime itself.","root_cause_evidence":"A controlled dirty-state reproduction showed that merely making both runtime and benchmark files dirty does not force `observed_ci_run_id=0`; under those conditions the selector still found matching runs and chose `25169323225`. That points away from a deterministic logic bug in the dirty-state path and toward either a transient GH observation failure or a rarer edge case.","benchmark_change":"`autoresearch.sh` now emits additional numeric metrics: `observed_ci_selection_tier` (`2` exact-runtime match, `1` workflow-only match, `0` fallback), `observed_ci_matching_run_count`, `observed_ci_exact_runtime_run_count`, `observed_ci_exact_run_runtime_count`, and `observed_ci_view_failure_count`. These diagnostics do not alter the modeled critical-path computation.","verification":"Added a failing test `test-node/autoresearch-script.test.cjs` first, made it pass by adding the new METRIC lines, ran `bash -n autoresearch.sh`, and reran `./autoresearch.sh` successfully. The current branch reported `observed_ci_selection_tier=2`, `observed_ci_matching_run_count=4`, `observed_ci_exact_runtime_run_count=4`, and `observed_ci_view_failure_count=0`, confirming normal exact-run anchoring on the current baseline.","rollback_reason":"","next_action_hint":"Use the new diagnostics to retry or reproduce any future `observed_ci_run_id=0` anomaly before trusting the metric. With benchmark robustness improved, the next promising lane is either a higher-signal legacy-step optimization or a benchmark-quality fix that can materially change the current ~84s baseline rather than just explain it.","changed_files":["autoresearch.sh","test-node/autoresearch-script.test.cjs"]}}
{"run":67,"commit":"0000000","metric":27.885,"metrics":{"web_local_s":7.767,"web_trunk_build_s":1.374,"web_trunk_build_cold_s":2.945,"web_trunk_build_cold_system_wasm_bindgen_s":1.384,"mcp_local_s":1.241,"tui_local_s":6.792,"modeled_jobs":4,"modeled_unknown_steps":0,"observed_ci_run_id":25171336235,"observed_ci_run_count":5,"observed_ci_selection_tier":1,"observed_ci_matching_run_count":5,"observed_ci_exact_runtime_run_count":0,"observed_ci_exact_run_runtime_count":0,"observed_ci_view_failure_count":0},"status":"discard","description":"Retried the inline-favicon candidate under the improved benchmark loop and new CI observation diagnostics.","timestamp":1777559954527,"segment":4,"confidence":10.443171579353839,"asi":{"hypothesis":"Now that the benchmark loop is more resilient and emits selection diagnostics, retry the inline-favicon cleanup alone to see whether it produces a measurable CI-runtime improvement or just re-exposes the earlier anchoring anomaly.","root_cause_evidence":"The favicon change worked functionally again (`favicon404 False` in a CI-like full legacy run), but the proxy collapsed to `27.885s` with `observed_ci_selection_tier=1`, `observed_ci_exact_runtime_run_count=0`, and `observed_ci_exact_run_runtime_count=0`. That proves this was not a real speedup; it was a workflow-match-only / runtime-dirty modeling case where the proxy trusted local run-step timings because no exact runtime-matching successful CI runs existed for the modified branch state.","verification":"Added a failing `index-html.test.cjs`, made it pass with `<link rel=\"icon\" href=\"data:,\" />`, reran `pnpm -C apps/egui-web run test:preflight`, verified no `/favicon.ico` fetches during one CI-like full legacy run, then ran `./autoresearch.sh` successfully.","rollback_reason":"The new diagnostics show this candidate's apparent win is a benchmarking artifact, not a trustworthy projected CI improvement. Inline favicon cleanup should remain pruned as a runtime optimization path.","next_action_hint":"Fix the benchmark-quality gap exposed here: when the selector is on workflow-match tier (`observed_ci_selection_tier=1`) with zero exact runtime matches, the proxy should model run steps more conservatively than raw local timings.","changed_files":["apps/egui-web/index.html","apps/egui-web/test-node/index-html.test.cjs"],"browser_evidence":"The static-server log contained no `/favicon.ico` requests after the inline favicon was added, confirming the behavior change itself was real even though the projected CI win was not."}}
{"run":68,"commit":"0000000","metric":0,"metrics":{"web_local_s":7.812,"web_trunk_build_s":1.377,"web_trunk_build_cold_s":3.468,"web_trunk_build_cold_system_wasm_bindgen_s":1.389,"mcp_local_s":1.225,"tui_local_s":6.728,"modeled_jobs":4,"modeled_unknown_steps":0,"observed_ci_run_id":25169323225,"observed_ci_run_count":4,"observed_ci_selection_tier":2,"observed_ci_matching_run_count":4,"observed_ci_exact_runtime_run_count":4,"observed_ci_exact_run_runtime_count":12,"observed_ci_view_failure_count":0},"status":"crash","description":"Tried to benchmark the workflow-match-only favicon scenario by wrapping `./autoresearch.sh` in a temporary dirty-working-tree command, but the experiment tool rejected custom commands while `autoresearch.sh` exists.","timestamp":1777560072609,"segment":4,"confidence":10.443171579353839,"asi":{"hypothesis":"Validate the new workflow-only conservative modeling by rerunning the previously misleading favicon scenario under a temporarily dirty runtime file while keeping only the benchmark-script change persistent.","root_cause_evidence":"`run_experiment` for autoresearch sessions enforces executing `./autoresearch.sh` directly and rejected the wrapped custom command before the benchmark ran, so this attempt produced no candidate metric.","rollback_reason":"This did not execute the intended experiment, so it provides no evidence for or against the benchmark change.","next_action_hint":"Use baseline `./autoresearch.sh` for the formal logged run, and rely on manual diagnostic reproduction plus the earlier favicon discard evidence to justify or reject the benchmark fix.","failure_detail":"Experiment tool error: `autoresearch.sh exists — you must run it instead of a custom command`."}}
