{"run":69,"commit":"f53aa38","metric":86,"metrics":{"web_local_s":7.657,"web_trunk_build_s":1.338,"web_trunk_build_cold_s":3.085,"web_trunk_build_cold_system_wasm_bindgen_s":1.345,"mcp_local_s":1.221,"tui_local_s":6.373,"modeled_jobs":4,"modeled_unknown_steps":0,"observed_ci_run_id":25171336235,"observed_ci_run_count":5,"observed_ci_selection_tier":2,"observed_ci_matching_run_count":5,"observed_ci_exact_runtime_run_count":5,"observed_ci_exact_run_runtime_count":13,"observed_ci_view_failure_count":0},"status":"keep","description":"Model workflow-match-only runtime-dirty candidates conservatively by taking the max of observed matching-run step durations and local run timings instead of trusting optimistic local timings alone.","timestamp":1777560348322,"segment":4,"confidence":10.294106451817546,"asi":{"hypothesis":"The inline-favicon retry showed a benchmark-integrity gap: when `observed_ci_selection_tier=1` (workflow match only, no exact runtime matches), the proxy could still massively understate CI time by trusting raw local run-step timings. Using the max of observed matching-run step timings and local timings should keep workflow-only candidates conservative without hiding real local regressions.","root_cause_evidence":"The retried favicon candidate produced an obviously bogus `27.885s` projection with `observed_ci_selection_tier=1`, `observed_ci_exact_runtime_run_count=0`, and `observed_ci_exact_run_runtime_count=0`. That proved the workflow-only branch was still overfitting to local run-step timings. After implementing the conservative max rule, a controlled manual reproduction of the same dirty favicon scenario projected `81.0s` instead of `27.885s` while still reporting `observed_ci_selection_tier=1`, bringing the result back near the clean split-preflight baseline rather than a fake giant win.","benchmark_change":"In the per-step job modeling loop, when the selector is on workflow-match tier (`observed_ci_selection_tier == 1`) and an observed matching-run cost exists for the same `[job, step]`, the proxy now uses `max(observed matching-run cost, local run cost)` for run steps. Exact-runtime matches still use observed exact costs directly, and pure fallback cases remain unchanged.","verification":"Added a failing test `test-node/autoresearch-script.test.cjs` first, made it pass, ran `bash -n autoresearch.sh`, manually reproduced the dirty favicon scenario to confirm the projection no longer collapses to ~28s, then reran `./autoresearch.sh` successfully on the clean branch. The clean branch now reports normal exact-runtime anchoring with `observed_ci_selection_tier=2` and `observed_ci_exact_runtime_run_count=5`.","rollback_reason":"","next_action_hint":"Future runtime-dirty candidates should no longer get false green lights from workflow-only matches. With this gap closed, the next promising work is a genuinely higher-signal runtime optimization in the remaining `Web Playwright legacy (static dist)` block or another benchmark-quality improvement that changes the clean-branch baseline materially rather than just preventing over-optimism.","changed_files":["autoresearch.sh","test-node/autoresearch-script.test.cjs"],"manual_reproduction_metric":81,"manual_reproduction_selection_tier":1}}
{"type":"config","name":"Optimize qni-webgpu GitHub Actions CI runtime","metricName":"projected_ci_s","metricUnit":"s","bestDirection":"lower"}
{"run":30,"commit":"4818e48","metric":82,"metrics":{"web_local_s":8.876,"web_trunk_build_s":1.472,"web_trunk_build_cold_s":8.31,"web_trunk_build_cold_system_wasm_bindgen_s":1.486,"mcp_local_s":1.396,"tui_local_s":6.774,"modeled_jobs":4,"modeled_unknown_steps":0,"observed_ci_run_id":25194317499,"observed_ci_run_count":1,"observed_ci_selection_tier":2,"observed_ci_matching_run_count":6,"observed_ci_exact_runtime_run_count":1,"observed_ci_exact_run_runtime_count":1,"observed_ci_view_failure_count":0},"status":"keep","description":"Resume the CI-runtime loop with the already-applied static-dist external-server contract fix as the new post-merge baseline.","timestamp":1777597814259,"segment":2,"confidence":null,"asi":{"hypothesis":"After the context reset and merge, the branch should be re-baselined from the current static-dist external-server contract fix before trying fresh candidates.","root_cause_evidence":"The resumed benchmark anchored exactly on successful CI run 25194317499 with selection tier 2, one exact-runtime run, zero unknown workflow steps, and projected_ci_s=82. That is better than the last pre-reset logged best of 86 and gives a clean post-merge baseline.","verification":"Ran ./autoresearch.sh successfully after re-initializing the tool state for qni-webgpu; parsed projected_ci_s=82 and all diagnostic metrics from the clean branch.","changed_files":[],"next_action_hint":"Continue from this 82s baseline. Prefer high-signal changes in the static-dist web/legacy lane or benchmark-quality fixes; do not revisit stale micro-tuning, duplicated-build fan-out, same-job web-suite parallelism, or worker-count experiments."}}
{"run":31,"commit":"0000000","metric":0,"metrics":{"web_local_s":8.876,"web_trunk_build_s":1.472,"web_trunk_build_cold_s":8.31,"web_trunk_build_cold_system_wasm_bindgen_s":1.486,"mcp_local_s":1.396,"tui_local_s":6.774,"modeled_jobs":4,"modeled_unknown_steps":0,"observed_ci_run_id":25194317499,"observed_ci_run_count":1,"observed_ci_selection_tier":2,"observed_ci_matching_run_count":6,"observed_ci_exact_runtime_run_count":1,"observed_ci_exact_run_runtime_count":1,"observed_ci_view_failure_count":0},"status":"crash","description":"Tried splitting the static-dist web lane into a build artifact plus two legacy Playwright shard jobs, but the shard command was malformed.","timestamp":1777598126700,"segment":2,"confidence":null,"asi":{"hypothesis":"Build the static web dist once, upload it as an artifact, then run BDD and two Playwright legacy shards in parallel jobs to reduce the 43s legacy critical-path block without duplicating Rust/Trunk compilation.","root_cause_evidence":"The benchmark failed before metrics because `pnpm run test:pw-legacy -- --shard=1/2` expands to `playwright test -- --shard=1/2`; Playwright interprets the extra bare `--` as a test-file pattern and reports `No tests found` on every bounded retry.","rollback_reason":"The candidate implementation used the wrong npm/pnpm argument forwarding form for Playwright shards, so no valid runtime comparison was produced.","next_action_hint":"Reapply the artifact+shard topology using `pnpm exec playwright test --shard=1/2` or an equivalent script that does not insert a bare `--`, then rerun the benchmark. Keep the TDD workflow/proxy tests but update their expected command text accordingly.","failure_detail":"All five shard-1 benchmark attempts failed with `playwright test -- --shard=1/2` and `Error: No tests found`."}}
{"run":32,"commit":"22af8ef","metric":37.419,"metrics":{"web_local_s":8.378,"web_trunk_build_s":1.434,"web_trunk_build_cold_s":6.118,"web_trunk_build_cold_system_wasm_bindgen_s":1.489,"mcp_local_s":1.567,"tui_local_s":6.939,"modeled_jobs":7,"modeled_unknown_steps":0,"observed_ci_run_id":25194317499,"observed_ci_run_count":5,"observed_ci_selection_tier":0,"observed_ci_matching_run_count":0,"observed_ci_exact_runtime_run_count":0,"observed_ci_exact_run_runtime_count":1,"observed_ci_view_failure_count":0},"status":"keep","description":"Split the static web lane into one build-artifact job plus parallel BDD and two legacy Playwright shard jobs.","timestamp":1777598349314,"segment":2,"confidence":null,"asi":{"hypothesis":"Build the static web dist once, upload it as an artifact, then run BDD and two Playwright legacy shards in parallel jobs so the 43s legacy step no longer sits serially behind BDD on the web critical path.","root_cause_evidence":"The current real web job is dominated by `Web Playwright legacy (static dist)` at about 43s after a 13s BDD step. The new topology preserves the same trunk build and validation commands but moves browser suites behind a single `web-build` dependency and splits the legacy suite into 7-test and 6-test Playwright shards. Local shard discovery confirmed all 13 legacy tests are covered exactly once.","verification":"Wrote failing workflow/proxy tests first, observed them fail, implemented the artifact+shard workflow and shard-aware proxy modeling, verified `bash -n autoresearch.sh`, root `node --test test-node/*.test.cjs`, and `pnpm -C apps/egui-web exec playwright test --list --shard=1/2` plus `--shard=2/2`. `./autoresearch.sh` then completed with zero unknown modeled steps.","benchmark_caveat":"The projected 37.419s is a large workflow-dirty fallback-tier estimate (`observed_ci_selection_tier=0`, no matching workflow runs). It is directionally promising but likely optimistic for GitHub job startup/artifact overhead; a real CI run is mandatory before treating this as an actual runtime win.","changed_files":[".github/workflows/ci.yml","autoresearch.sh","test-node/autoresearch-script.test.cjs","test-node/ci-workflow.test.cjs"],"next_action_hint":"Push this candidate to real CI next. If actual wall clock remains below the 82–83s d947 baseline, keep it; if artifact/job overhead erases the win, revert and add a benchmark-quality penalty for fallback-tier artifact fan-out topologies."}}
{"run":33,"commit":"c56ce1c","metric":134,"metrics":{"web_local_s":7.816,"web_trunk_build_s":1.366,"web_trunk_build_cold_s":4.519,"web_trunk_build_cold_system_wasm_bindgen_s":1.379,"mcp_local_s":1.416,"tui_local_s":6.358,"modeled_jobs":7,"modeled_unknown_steps":0,"observed_ci_run_id":25197655273,"observed_ci_run_count":1,"observed_ci_selection_tier":2,"observed_ci_matching_run_count":1,"observed_ci_exact_runtime_run_count":1,"observed_ci_exact_run_runtime_count":2,"observed_ci_view_failure_count":0},"status":"keep","description":"Conservatively model compile-heavy run steps when workflow candidates move them into renamed jobs, using the artifact-shard CI run as evidence.","timestamp":1777598974943,"segment":2,"confidence":1,"asi":{"hypothesis":"The artifact+shard topology exposed a benchmark-quality gap: moving the compile-heavy `Web trunk build` step from job `web` to renamed job `web-build` should not inherit optimistic local warm timings just because the step count stayed the same.","root_cause_evidence":"Real CI run 25197655273 on commit 22af8ef succeeded but regressed badly: wall clock about 156s, `web-build` 92s, and `Web trunk build` alone 68s. The previous proxy projected 37.419s because the workflow-dirty fallback modeled the renamed compile-heavy build from local cold timings and undercounted the cache/job-name effects. After the fix, the same topology anchors on run 25197655273 and projects 134s, much closer to the real outcome and correctly disqualifying the topology.","benchmark_change":"When exact run-runtime history exists but the current job name did not exist in that history, `normalize_run` now treats compile-heavy run steps conservatively via fallback/observed step costs instead of local timings. Exact matching job+step costs still win, and non-compile browser test shards still use measured local shard timings.","verification":"Added a failing source-level autoresearch test for renamed compile-heavy cost handling, made it pass, reran `bash -n autoresearch.sh` and root `node --test test-node/*.test.cjs`, then reran `./autoresearch.sh` successfully. The corrected proxy now reports projected_ci_s=134 with selection tier 2 against the real artifact-shard CI run.","changed_files":["autoresearch.sh","test-node/autoresearch-script.test.cjs"],"next_action_hint":"Now revert the artifact+shard workflow candidate back to the validated split-preflight topology. Under the corrected proxy the reverted topology should return near the 82s d947 baseline and should be kept despite abandoning the false 37s proxy win."}}
{"run":34,"commit":"ffe3ceb","metric":87,"metrics":{"web_local_s":7.991,"web_trunk_build_s":1.39,"web_trunk_build_cold_s":4.539,"web_trunk_build_cold_system_wasm_bindgen_s":1.388,"mcp_local_s":1.285,"tui_local_s":6.507,"modeled_jobs":4,"modeled_unknown_steps":0,"observed_ci_run_id":25194317499,"observed_ci_run_count":5,"observed_ci_selection_tier":1,"observed_ci_matching_run_count":6,"observed_ci_exact_runtime_run_count":0,"observed_ci_exact_run_runtime_count":2,"observed_ci_view_failure_count":0},"status":"keep","description":"Revert the artifact-sharded web workflow after real CI showed it was slower than the validated split-preflight topology.","timestamp":1777599247057,"segment":2,"confidence":1.7983098364292773,"asi":{"hypothesis":"After correcting the proxy and observing real CI, the branch should return to the validated split-preflight topology instead of the artifact+shard topology.","root_cause_evidence":"Real CI run 25197655273 for the artifact+shard candidate took about 156s wall clock, with `web-build` alone at 92s and `Web trunk build` at 68s. The previous d947 split-preflight run 25194317499 was about 83s web/job critical path and remains the better actual baseline.","verification":"Reverted commit 22af8ef while preserving the renamed-compile-heavy benchmark fix from c56ce1c, resolved conflicts, ran `bash -n autoresearch.sh`, root `node --test test-node/*.test.cjs`, and reran `./autoresearch.sh` successfully. The workflow returned to 4 jobs with zero modeled unknown steps.","benchmark_note":"The temporary working-tree metric is 87 with selection tier 1 because the reverted workflow was dirty relative to HEAD during measurement; after this keep commit, an exact clean rerun should re-anchor near the 82s d947 baseline.","changed_files":[".github/workflows/ci.yml","autoresearch.sh","test-node/autoresearch-script.test.cjs","test-node/ci-workflow.test.cjs","autoresearch.jsonl"],"next_action_hint":"Run a clean control benchmark after this commit to confirm the corrected split-preflight branch re-anchors near 82s. Then continue with a different hypothesis; artifact fan-out/sharding should be considered falsified unless a future benchmark explicitly models the 68s renamed-job trunk build/cache miss."}}
{"run":35,"commit":"0000000","metric":82,"metrics":{"web_local_s":7.946,"web_trunk_build_s":1.366,"web_trunk_build_cold_s":3.796,"web_trunk_build_cold_system_wasm_bindgen_s":1.388,"mcp_local_s":1.262,"tui_local_s":6.358,"modeled_jobs":4,"modeled_unknown_steps":0,"observed_ci_run_id":25194317499,"observed_ci_run_count":1,"observed_ci_selection_tier":2,"observed_ci_matching_run_count":6,"observed_ci_exact_runtime_run_count":1,"observed_ci_exact_run_runtime_count":2,"observed_ci_view_failure_count":0},"status":"discard","description":"Clean control rerun after reverting artifact sharding; confirmed the branch re-anchors on the validated split-preflight baseline.","timestamp":1777599408605,"segment":2,"confidence":8.9162,"asi":{"hypothesis":"The post-revert branch should cleanly match the validated d947 split-preflight workflow and produce the resumed 82s proxy baseline under the corrected benchmark.","root_cause_evidence":"After committing the artifact-shard revert, the clean rerun returned to projected_ci_s=82 with selection tier 2, zero unknown steps, and observed run 25194317499. This confirms the 87s revert measurement was only a dirty-worktree artifact.","rollback_reason":"No code change was being evaluated in this control run; the metric is equal to the current baseline, so there is nothing new to keep.","next_action_hint":"Proceed from the corrected split-preflight baseline. Avoid artifact fan-out/sharded legacy unless a future model explicitly accounts for renamed-job Rust cache misses. Look for a different high-signal bottleneck or benchmark-quality improvement."}}
{"run":36,"commit":"f40c6f5","metric":76.5,"metrics":{"web_local_s":7.805,"web_trunk_build_s":1.402,"web_trunk_build_cold_s":6.457,"web_trunk_build_cold_system_wasm_bindgen_s":1.398,"mcp_local_s":1.302,"tui_local_s":6.744,"modeled_jobs":4,"modeled_unknown_steps":0,"observed_ci_run_id":25198110827,"observed_ci_run_count":2,"observed_ci_selection_tier":2,"observed_ci_matching_run_count":7,"observed_ci_exact_runtime_run_count":2,"observed_ci_exact_run_runtime_count":3,"observed_ci_view_failure_count":0},"status":"keep","description":"Re-anchor the corrected split-preflight baseline after the latest real CI run reduced the observed median web critical path.","timestamp":1777599703946,"segment":2,"confidence":8.491619047619048,"asi":{"hypothesis":"After pushing the corrected/reverted branch, the new successful CI run should become part of the exact-runtime observed baseline and reduce the proxy toward the actual 73s web run.","root_cause_evidence":"CI run 25198110827 on ffe3ceb succeeded with web=73s, tui=33s, mcp=13s, and web-preflight=14s. Rerunning the proxy after that run yielded projected_ci_s=76.5 with two exact-runtime matching runs, improving over the stale 82s single-run baseline.","verification":"Reran ./autoresearch.sh on the clean branch after the CI run completed; it selected run 25198110827, reported selection tier 2, zero unknown steps, and observed_ci_exact_runtime_run_count=2.","changed_files":[],"next_action_hint":"Use 76.5s as the current corrected baseline. Future candidates must beat the real split-preflight topology where the web job is roughly: setup/cache/build 20s, BDD 8s, legacy 41s."}}
{"run":37,"commit":"c4df55f","metric":76.5,"metrics":{"web_local_s":8.647,"web_trunk_build_s":1.37,"web_trunk_build_cold_s":4.234,"web_trunk_build_cold_system_wasm_bindgen_s":1.375,"mcp_local_s":1.444,"tui_local_s":6.797,"modeled_jobs":4,"modeled_unknown_steps":0,"observed_ci_run_id":25198110827,"observed_ci_run_count":2,"observed_ci_selection_tier":2,"observed_ci_matching_run_count":7,"observed_ci_exact_runtime_run_count":2,"observed_ci_exact_run_runtime_count":3,"observed_ci_view_failure_count":0},"status":"keep","description":"Fix autoresearch static-server readiness probes so the benchmark no longer hides Python syntax failures before BDD and legacy measurements.","timestamp":1777599977482,"segment":2,"confidence":8.105636363636364,"asi":{"hypothesis":"The local benchmark's static-server readiness snippets should actually wait for the Python server and fail fast on probe errors; otherwise local BDD/legacy measurements can hide setup failures and become flaky or misleading.","root_cause_evidence":"Inspection of `/tmp/web-bdd-attempt-*.log` and `/tmp/web-legacy-attempt-*.log` showed `SyntaxError: url = fhttp://...` before otherwise-passing test commands. The URL f-string's double quotes were being stripped by the surrounding `bash -lc \"...\"` string, and the shell snippet did not use `set -e`, so the failed readiness probe was ignored.","benchmark_change":"The BDD and legacy benchmark snippets now use `set -euo pipefail` and build the readiness URL with a single-quoted Python string plus `.format(...)`, avoiding bash interpolation damage and making readiness probe failures abort the measured attempt.","verification":"Added a failing autoresearch-script source test for shell-safe readiness probes, made it pass, ran `bash -n autoresearch.sh` and `node --test test-node/autoresearch-script.test.cjs`, then reran `./autoresearch.sh` successfully. The metric remained at the current 76.5s baseline while the benchmark logs no longer start with the hidden SyntaxError.","changed_files":["autoresearch.sh","test-node/autoresearch-script.test.cjs"],"next_action_hint":"Continue from the corrected 76.5s baseline. The benchmark is now safer for further web BDD/legacy experiments because readiness failures are no longer silently ignored."}}
