{"run":41,"commit":"0000000","metric":0,"metrics":{"web_local_s":7.704,"web_trunk_build_s":1.344,"web_trunk_build_cold_s":4.319,"web_trunk_build_cold_system_wasm_bindgen_s":1.358,"mcp_local_s":1.212,"tui_local_s":6.485,"modeled_jobs":3,"modeled_unknown_steps":0,"observed_ci_run_id":25164375879,"observed_ci_run_count":5},"status":"crash","description":"Tried replacing the 50ms post-drag preview settles in the web tests with a single-frame wait helper (`16ms`).","timestamp":1777551520447,"segment":4,"confidence":14.626464755723813,"asi":{"hypothesis":"The web test lane still contains about 550ms of fixed 50ms sleeps after drag actions; replacing them with a single-frame settle helper should preserve intent while shaving a noticeable fraction of the local legacy/Bdd runtime.","root_cause_evidence":"Targeted CI-like reruns showed the single-frame version was not stable enough. BDD stayed green, but a 3-run legacy sample produced one slow failure (`dragged palette gate keeps rounded corners`) and `./autoresearch.sh` then failed in the repeated `test:pw-legacy` measurement. This indicates at least some drag-preview sampling paths still need more than one extra frame after `dragPointer` before pixel assertions become deterministic.","verification":"Added a failing unit test for a shared paint-settle helper, implemented it, rewired the raw 50ms waits through that helper, reran `node --test apps/egui-web/test-node/egui-helpers.test.cjs`, reran `pnpm -C apps/egui-web run test:preflight`, and ran repeated CI-like BDD plus legacy suites against isolated static servers before the full benchmark.","rollback_reason":"The single-frame settle overfits to the fast local case and makes the legacy suite flaky under repeated CI-like runs, so it is not safe to benchmark further or push to real CI.","next_action_hint":"Let autoresearch revert this change, then either abandon the raw sleep-reduction lane or only retry it with a clearly safer synchronization strategy that preserves determinism rather than blindly shrinking waits.","failure_detail":"`./autoresearch.sh` crashed in the repeated `pnpm run test:pw-legacy` benchmark after the 16ms settle change; an earlier manual 3-run sample already showed a 1/3 failure rate for the legacy suite."}}
{"run":42,"commit":"0000000","metric":28.745,"metrics":{"web_local_s":7.734,"web_trunk_build_s":1.339,"web_trunk_build_cold_s":4.011,"web_trunk_build_cold_system_wasm_bindgen_s":1.353,"mcp_local_s":1.235,"tui_local_s":6.736,"modeled_jobs":3,"modeled_unknown_steps":0,"observed_ci_run_id":25164643080,"observed_ci_run_count":5},"status":"discard","description":"Tried reducing the egui helper polling interval from 100ms to 50ms for startup/state-vector/canvas readiness waits.","timestamp":1777551733040,"segment":4,"confidence":14.852723112128144,"asi":{"hypothesis":"More frequent readiness polling should reduce average slack in the web suite without changing semantics, because the tests could observe app readiness closer to the moment it becomes true.","root_cause_evidence":"The tuned interval stayed stable under repeated CI-like BDD and legacy runs, but it did not actually help the warmed local timings: BDD was roughly flat while legacy drifted slightly slower (about 4.6s median versus the current ~4.3s neighborhood). The full proxy also regressed from the current 6-worker/no-install branch state.","verification":"Added a failing unit test to lock the intended helper poll interval, updated `apps/egui-web/features/support/egui-helpers.cjs`, reran `node --test apps/egui-web/test-node/egui-helpers.test.cjs`, reran `pnpm -C apps/egui-web run test:preflight`, ran repeated CI-like BDD and legacy suites against isolated static servers, and then ran `./autoresearch.sh`.","rollback_reason":"This changed synchronization cadence but produced no real speed win under the corrected benchmark, so it is not worth carrying or validating on real CI.","next_action_hint":"Revert the polling-interval tweak and move away from generic wait-tuning. The remaining promising work is either another benchmark-integrity improvement or a materially different CI bottleneck with larger upside."}}
{"run":43,"commit":"0000000","metric":0,"metrics":{"web_local_s":7.704,"web_trunk_build_s":1.344,"web_trunk_build_cold_s":4.319,"web_trunk_build_cold_system_wasm_bindgen_s":1.358,"mcp_local_s":1.212,"tui_local_s":6.485,"modeled_jobs":3,"modeled_unknown_steps":0,"observed_ci_run_id":25164643080,"observed_ci_run_count":5},"status":"crash","description":"Tried collapsing the sequential static-dist BDD + legacy workflow steps into a single parallel web-suites step that runs both test suites concurrently against one shared static server.","timestamp":1777552381048,"segment":4,"confidence":14.852723112128144,"asi":{"hypothesis":"The web critical path is currently the sequential sum of BDD plus legacy after `trunk build`; running those suites concurrently against one shared static server in the same job could cut roughly 2 seconds locally and potentially much more on CI without duplicating setup.","root_cause_evidence":"Ad-hoc local measurements showed an attractive median for concurrent execution (~4.8s vs ~6.9s sequential), but repeated verification was not stable enough. A 3-run verification sample failed once in the legacy suite with `page.waitForFunction: Timeout 20000ms exceeded` while BDD was running concurrently, and the full `./autoresearch.sh` run then crashed during repeated legacy measurement. The likely issue is resource contention during simultaneous browser-heavy suites rather than a deterministic command bug.","verification":"Added a shared parallel-runner shell script, rewired the workflow and benchmark harness to use it, reran `pnpm -C apps/egui-web run test:preflight`, and ran repeated local parallel suite invocations against isolated static servers before the full benchmark.","rollback_reason":"Even though the concurrent lane has upside, the current implementation is too flaky under repeated local CI-like runs to justify keeping or pushing it to real CI.","next_action_hint":"Let autoresearch revert this draft. If this lane is revisited, reduce contention explicitly (for example by lowering BDD parallelism only in the concurrent mode or otherwise bounding total browser concurrency) and verify stability before reintroducing the workflow change.","failure_detail":"The candidate failed local repeated verification and `./autoresearch.sh`; during parallel verification the legacy suite hit `TimeoutError: page.waitForFunction: Timeout 20000ms exceeded` in `waitForAppReady`, indicating the combined workload can starve browser startup/readiness."}}
{"run":44,"commit":"0000000","metric":0,"metrics":{"web_local_s":7.704,"web_trunk_build_s":1.344,"web_trunk_build_cold_s":4.319,"web_trunk_build_cold_system_wasm_bindgen_s":1.358,"mcp_local_s":1.212,"tui_local_s":6.485,"modeled_jobs":3,"modeled_unknown_steps":0,"observed_ci_run_id":25164643080,"observed_ci_run_count":5},"status":"crash","description":"Retried the parallel static-dist web-suites lane with explicit Cucumber parallelism forced down to 1 during the concurrent run.","timestamp":1777552740137,"segment":4,"confidence":14.852723112128144,"asi":{"hypothesis":"The parallel BDD+legacy lane probably failed because total browser concurrency was too high; forcing Cucumber down to one scenario at a time during the combined run might preserve most of the overlap win while avoiding startup starvation.","root_cause_evidence":"Even with BDD parallelism forced to 1, repeated local verification was still flaky. One verification run timed out in the BDD startup scenario (`When the app finishes initializing`), and `./autoresearch.sh` then crashed in the repeated parallel benchmark command. This suggests the contention problem is deeper than Cucumber’s scenario fan-out and likely comes from sharing one runner between simultaneous browser-heavy suites.","verification":"Added a failing config test for an explicit Cucumber parallel override, implemented the env-based override, recreated the shared parallel-runner script and workflow/benchmark wiring, reran the targeted cucumber-config test, reran `pnpm -C apps/egui-web run test:preflight`, and ran repeated local parallel-suite invocations against isolated static servers before the full benchmark.","rollback_reason":"The contention-reduced variant is still unstable under repeated CI-like runs, so this lane is not safe enough to keep exploring in its current form.","next_action_hint":"Let autoresearch revert this draft and prune the same-job parallel web-suites lane for now. Shift back to benchmark integrity or a completely different bottleneck rather than trying to force two browser suites to share one runner concurrently.","failure_detail":"Parallel verification with `QNI_EGUI_WEB_CUCUMBER_PARALLEL=1` still produced a 20s BDD startup timeout, and the repeated `web-parallel` benchmark command failed in `./autoresearch.sh`."}}
{"run":45,"commit":"0000000","metric":0,"metrics":{"web_local_s":7.704,"web_trunk_build_s":1.344,"web_trunk_build_cold_s":4.319,"web_trunk_build_cold_system_wasm_bindgen_s":1.358,"mcp_local_s":1.212,"tui_local_s":6.485,"modeled_jobs":3,"modeled_unknown_steps":0,"observed_ci_run_id":25164375879,"observed_ci_run_count":5},"status":"crash","description":"Tried tightening exact observed-run matching so the proxy only reuses historical CI timings when both the workflow step names and the runtime-relevant tracked files match the current branch state.","timestamp":1777553177528,"segment":4,"confidence":14.852723112128144,"asi":{"hypothesis":"Step-name-only workflow matching is still too coarse, because runs like the 7-worker candidate and the restored 6-worker branch share identical job step names while materially differing in runtime-relevant test configuration. Requiring relevant tracked files to match should make exact observed-run reuse less overfit-prone.","root_cause_evidence":"Direct inspection showed real CI run `25164375879` (7-worker candidate) and run `25164643080` (restored 6-worker branch) have identical workflow step names, so the current proxy treats them as exact matches even though `apps/egui-web/playwright.config.cjs` and its preflight contract changed between the two commits. That is a benchmark-integrity gap. However the first validation attempt hit an unrelated flaky legacy benchmark run before the new matching logic could produce metrics.","rollback_reason":"Cannot judge the benchmark-improvement candidate from this run because `./autoresearch.sh` crashed in a repeated local `test:pw-legacy` measurement unrelated to the new matching logic itself.","next_action_hint":"Reapply the runtime-fingerprint matching change and rerun the same benchmark-improvement experiment. The next run needs to confirm that exact-match selection now excludes the 7-worker CI run from the current 6-worker branch state.","failure_detail":"The failed `run_experiment` died inside the existing repeated legacy benchmark command; manual reruns immediately after the crash passed 3/3, so this looks like a transient legacy-suite flake rather than evidence against the matching change."}}
{"run":46,"commit":"1a623f3","metric":29.764,"metrics":{"web_local_s":7.708,"web_trunk_build_s":1.338,"web_trunk_build_cold_s":5.056,"web_trunk_build_cold_system_wasm_bindgen_s":1.359,"mcp_local_s":1.382,"tui_local_s":6.349,"modeled_jobs":3,"modeled_unknown_steps":0,"observed_ci_run_id":25164643080,"observed_ci_run_count":4},"status":"keep","description":"Tighten exact observed-run matching so the proxy only reuses historical CI timings when both the workflow step names and the runtime-relevant tracked files match the current branch state.","timestamp":1777553455153,"segment":4,"confidence":16.32126332729833,"asi":{"hypothesis":"Step-name-only workflow matching is still too coarse, because runs like the 7-worker candidate and the restored 6-worker branch share identical job step names while materially differing in runtime-relevant test configuration. Requiring relevant tracked files to match should make exact observed-run reuse less overfit-prone.","root_cause_evidence":"Real CI runs `25164375879` (7-worker candidate) and `25164643080` (restored 6-worker branch) have identical workflow step names, so the previous proxy treated both as exact matches. However `git diff <run_sha> HEAD -- .github/workflows/ci.yml Makefile scripts/check-all.sh apps/egui-web apps/mcp-qni apps/tui` shows the 7-worker head differs from the current branch in runtime-relevant files (`apps/egui-web/playwright.config.cjs` and its preflight contract), while the current head and the older 6-worker/no-install heads still match exactly.","benchmark_change":"`autoresearch.sh` now first looks for successful CI runs whose job step names match the current workflow and whose runtime-relevant tracked files also match the current branch state. Only if no such runs exist does it fall back to step-name-only workflow matching, and only after that to generic recent successful runs.","changed_files":["autoresearch.sh"],"verification":"Validated the new selector logic manually against recent CI history: the current branch now exact-matches runs `25164643080`, `25163578570`, `25162727553`, and `25161542044`, while correctly excluding the 7-worker run `25164375879` despite identical workflow step names. Then reran `./autoresearch.sh` successfully.","rollback_reason":"","next_action_hint":"Use this stricter benchmark to re-evaluate future close-call candidates; it should prevent exact observed timings from inheriting runtime from branches that only look identical at the YAML step-name level."}}
{"run":47,"commit":"af59406","metric":82,"metrics":{"web_local_s":7.948,"web_trunk_build_s":1.385,"web_trunk_build_cold_s":3.496,"web_trunk_build_cold_system_wasm_bindgen_s":1.389,"mcp_local_s":1.244,"tui_local_s":6.535,"modeled_jobs":3,"modeled_unknown_steps":0,"observed_ci_run_id":25166587211,"observed_ci_run_count":5},"status":"keep","description":"When exact runtime-matching CI runs exist, make the proxy use their observed run-step durations directly instead of overriding them with local command timings.","timestamp":1777553984429,"segment":4,"confidence":14.978860888027326,"asi":{"hypothesis":"Once the proxy has successful CI runs that match both the current workflow and the current runtime-relevant files, those exact observed step durations should be more trustworthy than local machine timings for the same run steps.","root_cause_evidence":"Even after tightening exact-run selection, the proxy still overrode matching CI run-step durations with local command medians for `Web preflight`, `Web trunk build`, `Web Cucumber BDD`, `Web Playwright legacy`, `MCP check`, and `TUI check`. That kept the projected metric artificially low (~30s) despite exact matching real CI evidence around the mid-80s for the current branch state.","benchmark_change":"`autoresearch.sh` now prefers observed per-job-step durations for all steps, including `run:` steps, whenever the selected successful runs are exact runtime matches for the current branch state. Only when such exact runtime matches do not exist does it fall back to local command timings for those steps.","changed_files":["autoresearch.sh"],"verification":"Reran `./autoresearch.sh` successfully after the change. The projected metric moved from the unrealistic ~30s range to `82s`, which is much closer to the real CI evidence for the current branch state, and the selector anchored on the latest exact runtime-matching run set (`observed_ci_run_id=25166587211`, `observed_ci_run_count=5`).","rollback_reason":"","next_action_hint":"Use this more realistic proxy for the next non-benchmark experiment. With exact runtime matches now consuming observed run-step timings directly, future close-call wins should need less real-CI correction."}}
{"run":48,"commit":"0000000","metric":26.265,"metrics":{"web_local_s":7.998,"web_trunk_build_s":1.377,"web_trunk_build_cold_s":3.117,"web_trunk_build_cold_system_wasm_bindgen_s":1.399,"mcp_local_s":1.436,"tui_local_s":6.873,"modeled_jobs":4,"modeled_unknown_steps":0,"observed_ci_run_id":25166828471,"observed_ci_run_count":5},"status":"discard","description":"Tried splitting `Web preflight` into its own parallel `web-preflight` job so the main `web` job could start `trunk build` immediately.","timestamp":1777554326981,"segment":4,"confidence":16.32126332729833,"asi":{"hypothesis":"`Web preflight` is a short node-only validation step on the current web critical path. Moving it into its own parallel job should preserve coverage while shaving a few seconds from the main web job’s wall time.","root_cause_evidence":"The candidate produced an implausibly large proxy win (`82s -> 26s`) because this is a workflow-dirty branch state with no exact runtime match, so the model fell back to fast local timings for the run steps while still using observed setup durations. That is precisely the remaining benchmark-quality gap around workflow-dirty candidates noted in the ideas file, not credible evidence of a real 56-second CI win.","verification":"Updated `.github/workflows/ci.yml` to add a parallel `web-preflight` job and remove `Web preflight` from the main `web` job, then reran `./autoresearch.sh`. The YAML parsed cleanly and the benchmark completed, but the resulting metric was too obviously artifact-driven to trust.","rollback_reason":"Do not spend a real CI run on a candidate whose projected improvement is clearly dominated by the workflow-dirty fallback model rather than believable step-level savings.","next_action_hint":"Let autoresearch revert this workflow draft, then improve the benchmark for workflow-dirty candidates—for example by reusing observed run-step durations when app/test runtime files still match even if the workflow topology changed. Re-evaluate the split-preflight idea only after that benchmark gap is closed."}}
{"run":49,"commit":"0000000","metric":0,"metrics":{"web_local_s":7.948,"web_trunk_build_s":1.385,"web_trunk_build_cold_s":3.496,"web_trunk_build_cold_system_wasm_bindgen_s":1.389,"mcp_local_s":1.244,"tui_local_s":6.535,"modeled_jobs":3,"modeled_unknown_steps":0,"observed_ci_run_id":25166587211,"observed_ci_run_count":5},"status":"crash","description":"Tried extending the proxy so workflow-dirty candidates can still reuse observed run-step durations when the app/test runtime files match the current branch state.","timestamp":1777554542270,"segment":4,"confidence":16.32126332729833,"asi":{"hypothesis":"Even when the workflow file changes and exact overall runtime matching is unavailable, the proxy should still be able to reuse observed durations for known run steps if the app/test runtime files themselves still match a set of successful CI runs.","root_cause_evidence":"The first validation attempt did not fail in the new matching logic itself; it hit another transient repeated `test:pw-legacy` benchmark failure before metrics were emitted. Recent manual reruns of the same legacy command have often passed immediately afterward, so this looks like the same flaky local benchmark behavior seen in earlier sessions rather than evidence against the benchmark-change hypothesis.","rollback_reason":"Cannot judge the benchmark-change candidate from this run because the repeated local legacy benchmark crashed before `./autoresearch.sh` could finish.","next_action_hint":"Let autoresearch revert this crash entry only in code-preserving files, reapply the workflow-dirty run-step matching change if needed, and rerun the same benchmark-improvement experiment. The next successful run should confirm whether workflow-dirty candidates can be modeled against observed run-step durations instead of unrealistically fast local timings.","failure_detail":"`run_experiment` failed inside the repeated local `pnpm run test:pw-legacy` benchmark command before the new workflow-dirty matching logic could produce output."}}
