{"run":60,"commit":"372bfa7","metric":74.304,"metrics":{"web_local_s":8.045,"web_trunk_build_s":1.344,"web_trunk_build_cold_s":6.304,"web_trunk_build_cold_system_wasm_bindgen_s":1.348,"web_static_suites_s":0,"mcp_local_s":1.223,"tui_local_s":6.328,"modeled_jobs":4,"modeled_unknown_steps":0,"observed_ci_run_id":25200520918,"observed_ci_run_count":5,"observed_ci_selection_tier":1,"observed_ci_matching_run_count":17,"observed_ci_exact_runtime_run_count":0,"observed_ci_exact_run_runtime_count":0,"observed_ci_view_failure_count":0},"status":"keep","description":"Run all three egui-web Cucumber scenarios concurrently on CI by raising cucumber-js parallelism from 2 to 3.","timestamp":1777605988438,"segment":2,"confidence":14.860333333333335,"asi":{"hypothesis":"The Web BDD suite has exactly three scenarios. CI parallelism of 2 forces a second wave, so raising cucumber-js parallelism to 3 should run all BDD scenarios in one wave and reduce the sometimes-large BDD step without dropping coverage.","implementation":"Changed `apps/egui-web/cucumber.cjs` CI parallelism from 2 to 3 and updated the preflight expectation.","verification":"Ran `pnpm -C apps/egui-web run test:preflight`, ran CI-like external-server `pnpm run test:bdd`, and reran `./autoresearch.sh` successfully with zero unknown modeled steps.","benchmark_note":"The proxy is workflow-match tier 1 until this runtime/config change has a real CI run. Local BDD remains green; real CI must confirm that one more Cucumber worker does not cause WebGPU/Chromium startup contention.","coverage_note":"No scenarios, steps, or assertions changed; only scenario scheduling changed.","changed_files":["apps/egui-web/cucumber.cjs","apps/egui-web/test-node/cucumber-config.test.cjs"],"next_action_hint":"Push and compare real CI BDD/web durations against the 76s exact baseline. Revert if BDD or web gets slower."}}
{"run":61,"commit":"1bd722a","metric":76,"metrics":{"web_local_s":8.12,"web_trunk_build_s":1.355,"web_trunk_build_cold_s":12.132,"web_trunk_build_cold_system_wasm_bindgen_s":1.431,"web_static_suites_s":0,"mcp_local_s":1.356,"tui_local_s":7.166,"modeled_jobs":4,"modeled_unknown_steps":0,"observed_ci_run_id":25200809846,"observed_ci_run_count":1,"observed_ci_selection_tier":2,"observed_ci_matching_run_count":17,"observed_ci_exact_runtime_run_count":1,"observed_ci_exact_run_runtime_count":1,"observed_ci_view_failure_count":0},"status":"keep","description":"Exact CI validation showed Cucumber parallelism 3 keeps BDD at 9s and web at 78s without dropping scenarios.","timestamp":1777606292419,"segment":2,"confidence":14.860333333333335,"asi":{"hypothesis":"Running all three BDD scenarios concurrently should reduce the BDD step when it would otherwise run in two waves.","root_cause_evidence":"Real CI run 25200809846 on 372bfa7 succeeded with `web=78s`, `Web Cucumber BDD=9s`, and `Web Playwright legacy=42s`. This improves the web job wall time compared with recent exact runs around 80s and avoids the prior 16s BDD outlier.","verification":"Post-push `./autoresearch.sh` selected the candidate run exactly with zero unknown modeled steps. All CI jobs passed.","coverage_note":"No Cucumber scenarios or assertions changed; only the CI scenario scheduling increased from 2 to 3 workers to match the three-scenario suite.","changed_files":[],"next_action_hint":"Continue from 76s exact proxy / 78s real web. Remaining gains likely need another legacy-test simplification or a model update that better tracks web job overhead."}}
{"run":62,"commit":"0000000","metric":76.5,"metrics":{"web_local_s":9.411,"web_trunk_build_s":1.599,"web_trunk_build_cold_s":15.784,"web_trunk_build_cold_system_wasm_bindgen_s":1.616,"web_static_suites_s":0,"mcp_local_s":1.519,"tui_local_s":6.916,"modeled_jobs":4,"modeled_unknown_steps":0,"observed_ci_run_id":25200925612,"observed_ci_run_count":2,"observed_ci_selection_tier":2,"observed_ci_matching_run_count":17,"observed_ci_exact_runtime_run_count":2,"observed_ci_exact_run_runtime_count":2,"observed_ci_view_failure_count":0},"status":"discard","description":"Clean control after the BDD parallelism validation run; exact median is 76.5s with two matching runs.","timestamp":1777606555619,"segment":2,"confidence":14.860333333333335,"asi":{"hypothesis":"A second exact run after BDD parallelism should confirm the current baseline and quantify noise.","root_cause_evidence":"The control selected run 25200925612 at tier 2 with two exact-runtime runs and projected 76.5s. The second run had `web=80s`, so real web remains around 78-80s after the kept BDD parallelism and legacy trims.","rollback_reason":"Control-only run with no intended source change; metric is essentially baseline/noise.","next_action_hint":"Continue from 76-76.5s exact proxy. Further changes need real enough win to beat the remaining web-job noise."}}
{"run":63,"commit":"0000000","metric":81.151,"metrics":{"web_local_s":9.229,"web_trunk_build_s":1.59,"web_trunk_build_cold_s":13.151,"web_trunk_build_cold_system_wasm_bindgen_s":1.61,"web_static_suites_s":0,"mcp_local_s":1.461,"tui_local_s":6.452,"modeled_jobs":4,"modeled_unknown_steps":0,"observed_ci_run_id":25200925612,"observed_ci_run_count":5,"observed_ci_selection_tier":1,"observed_ci_matching_run_count":17,"observed_ci_exact_runtime_run_count":0,"observed_ci_exact_run_runtime_count":0,"observed_ci_view_failure_count":0},"status":"discard","description":"Tried removing the intermediate single-H assertion from the two-H legacy test, but proxy worsened.","timestamp":1777606770940,"segment":2,"confidence":15.730769230769214,"asi":{"hypothesis":"Because the canvas smoke now covers a single H state update, the two-H test might only need the final uniform-superposition assertion.","verification":"Added a source test, removed the intermediate single-H wait/assertion, ran `pnpm -C apps/egui-web run test:preflight`, ran CI-like external-server `pnpm run test:pw-legacy`, and reran `./autoresearch.sh` successfully.","rollback_reason":"The proxy worsened to 81.151s and local legacy timing was noisy/slower, so the simplification is not worth keeping or pushing.","next_action_hint":"Leave the two-H test unchanged. Avoid further tiny state-assertion removals unless they produce a clear local and proxy win."}}
{"run":64,"commit":"0000000","metric":90.852,"metrics":{"web_local_s":9.406,"web_trunk_build_s":1.646,"web_trunk_build_cold_s":22.852,"web_trunk_build_cold_system_wasm_bindgen_s":1.629,"web_static_suites_s":0,"mcp_local_s":1.491,"tui_local_s":6.841,"modeled_jobs":4,"modeled_unknown_steps":0,"observed_ci_run_id":25200925612,"observed_ci_run_count":5,"observed_ci_selection_tier":1,"observed_ci_matching_run_count":17,"observed_ci_exact_runtime_run_count":0,"observed_ci_exact_run_runtime_count":0,"observed_ci_view_failure_count":0},"status":"discard","description":"Tried reordering the expensive placed-gate visual test into the first Playwright worker wave, but local/proxy timing got worse.","timestamp":1777607128152,"segment":2,"confidence":14.860333333333335,"asi":{"hypothesis":"Starting the previously slow placed-gate visual test in the first 6-worker wave might reduce the CI legacy tail without changing coverage.","verification":"Added a source-order test, moved the placed-gate visual test earlier, ran `pnpm -C apps/egui-web run test:preflight`, ran CI-like external-server `pnpm run test:pw-legacy`, and reran `./autoresearch.sh` successfully.","rollback_reason":"Local legacy timing increased and the proxy worsened sharply to 90.852s; scheduling by source order is too noisy/risky to keep.","next_action_hint":"Do not pursue source-order scheduling. Look for actual test work reduction or workflow-level wins with real CI evidence."}}
{"run":65,"commit":"0000000","metric":84.064,"metrics":{"web_local_s":9.235,"web_trunk_build_s":1.629,"web_trunk_build_cold_s":16.064,"web_trunk_build_cold_system_wasm_bindgen_s":1.675,"web_static_suites_s":0,"mcp_local_s":1.636,"tui_local_s":7.006,"modeled_jobs":4,"modeled_unknown_steps":0,"observed_ci_run_id":25200925612,"observed_ci_run_count":5,"observed_ci_selection_tier":1,"observed_ci_matching_run_count":17,"observed_ci_exact_runtime_run_count":0,"observed_ci_exact_run_runtime_count":0,"observed_ci_view_failure_count":0},"status":"discard","description":"Tried skipping state-vector readiness during startup for pure visual Playwright tests, but local/proxy timing got worse.","timestamp":1777607527870,"segment":2,"confidence":14.860333333333335,"asi":{"hypothesis":"Several pure visual legacy Playwright tests do not read the state vector, so starting them after egui app readiness instead of waiting for state-vector readiness might reduce startup wait time while preserving their visual assertions.","verification":"Added a source test identifying pure visual tests, changed those tests to call `waitForStartupReady(page)` without `{ waitForStateVector: true }`, ran `pnpm -C apps/egui-web run test:preflight`, ran CI-like external-server `pnpm run test:pw-legacy`, and reran `./autoresearch.sh` successfully.","rollback_reason":"The local legacy suite remained green, but the benchmark worsened to projected_ci_s=84.064 and `web_local_s=9.235`, so the change likely increases render flakiness/settling cost or just adds noise. It is not worth pushing to CI.","next_action_hint":"Keep state-vector readiness in visual tests. Avoid startup-wait micro-tuning unless it shows a clear local win before the proxy run."}}
{"run":66,"commit":"0000000","metric":0,"metrics":{"web_local_s":0,"web_trunk_build_s":0,"web_trunk_build_cold_s":0,"web_trunk_build_cold_system_wasm_bindgen_s":0,"web_static_suites_s":0,"mcp_local_s":0,"tui_local_s":0,"modeled_jobs":0,"modeled_unknown_steps":0,"observed_ci_run_id":25200925612,"observed_ci_run_count":0,"observed_ci_selection_tier":0,"observed_ci_matching_run_count":0,"observed_ci_exact_runtime_run_count":0,"observed_ci_exact_run_runtime_count":0,"observed_ci_view_failure_count":0},"status":"crash","description":"Tried folding two-H state-vector coverage into the canvas smoke test to remove one legacy Playwright browser startup, but the benchmark run failed.","timestamp":1777607929997,"segment":2,"confidence":14.860333333333335,"asi":{"hypothesis":"The two-H uniform-superposition legacy Playwright test repeats the same startup and H-on-q0 setup as the canvas smoke test; moving its final H-on-q1 assertion into the smoke test could preserve state-vector coverage while removing one browser page/test from the legacy suite.","verification":"Added a source test requiring the separate two-H test to be removed and its expectedUniform assertion to be present in the canvas smoke test. `pnpm -C apps/egui-web run test:preflight` passed and a manual CI-like external-server `pnpm run test:pw-legacy` passed with 12 tests before running the full benchmark.","rollback_reason":"`./autoresearch.sh` failed inside the legacy Playwright benchmark command even though the preceding targeted run passed. Without a successful benchmark metric, this grouping is too risky to keep.","next_action_hint":"If revisiting this idea, first capture the exact Playwright failure output from the benchmark path and determine whether folding state assertions into canvas smoke introduces flake; otherwise prefer smaller, non-grouping reductions."}}
{"run":67,"commit":"0000000","metric":84.537,"metrics":{"web_local_s":9.634,"web_trunk_build_s":1.67,"web_trunk_build_cold_s":16.537,"web_trunk_build_cold_system_wasm_bindgen_s":1.715,"web_static_suites_s":0,"mcp_local_s":1.564,"tui_local_s":6.951,"modeled_jobs":4,"modeled_unknown_steps":0,"observed_ci_run_id":25200925612,"observed_ci_run_count":5,"observed_ci_selection_tier":1,"observed_ci_matching_run_count":17,"observed_ci_exact_runtime_run_count":0,"observed_ci_exact_run_runtime_count":0,"observed_ci_view_failure_count":0},"status":"discard","description":"Removed the redundant first 50ms wait in the placed-gate visual test, but proxy timing worsened.","timestamp":1777608165862,"segment":2,"confidence":14.860333333333335,"asi":{"hypothesis":"The placed-gate visual test waited 50ms immediately after dropping sqrtX and then moved the mouse away and waited another 50ms before taking the baseline screenshot. The first wait should be redundant because the post-move wait still lets the final baseline settle before assertions.","verification":"Added a source test that the placed-gate visual baseline setup contains only one 50ms wait, removed the pre-mouse-away wait, ran `pnpm -C apps/egui-web run test:preflight`, ran CI-like external-server `pnpm run test:pw-legacy`, and ran `./autoresearch.sh`.","rollback_reason":"All targeted tests passed, but the benchmark worsened to projected_ci_s=84.537 with web_local_s=9.634, so this tiny wait cleanup is noise or harmful under the proxy.","next_action_hint":"Do not pursue raw-wait micro-removals in visual tests unless there is a larger structural reduction. Look for real work removal, not 50ms trims."}}
{"run":68,"commit":"9dcd055","metric":77.393,"metrics":{"web_local_s":9.147,"web_trunk_build_s":1.594,"web_trunk_build_cold_s":9.393,"web_trunk_build_cold_system_wasm_bindgen_s":1.624,"web_static_suites_s":0,"mcp_local_s":1.573,"tui_local_s":6.435,"modeled_jobs":4,"modeled_unknown_steps":0,"observed_ci_run_id":25200925612,"observed_ci_run_count":5,"observed_ci_selection_tier":1,"observed_ci_matching_run_count":17,"observed_ci_exact_runtime_run_count":0,"observed_ci_exact_run_runtime_count":0,"observed_ci_view_failure_count":0},"status":"keep","description":"Use clipped page screenshots for pixel-sampling helper so visual tests avoid encoding full-canvas screenshots for tiny probes.","timestamp":1777608757426,"segment":2,"confidence":14.860333333333335,"asi":{"hypothesis":"The legacy and BDD visual assertions sample only a handful of canvas pixels, but `sampleCanvasPixels` encoded and decoded the entire canvas for every sample set. Taking a clipped page screenshot around requested probes should preserve exact pixel assertions while reducing screenshot/PNG/decode work in the visual tests.","verification":"Changed `sampleCanvasPixels` to compute a padded CSS-pixel bounding box around probes and use `page.screenshot({ clip })` with the existing retry/state-vector readiness behavior. Updated node tests to verify clipped screenshots and retry semantics, ran `pnpm -C apps/egui-web run test:preflight`, ran CI-like external-server `pnpm run test:pw-legacy`, and ran `./autoresearch.sh` successfully.","benchmark_result":"projected_ci_s=77.393 vs the active autoresearch baseline of 82s; web_local_s=9.147. The selector is workflow-match/runtime-dirty tier 1 with zero exact runtime CI matches, so this must still be validated by real GitHub Actions before treating it as a confirmed CI runtime win.","next_action_hint":"Push and trigger exact CI for the clipped-screenshot helper. If real `Web Playwright legacy (static dist)` or web job wall-clock does not improve versus the 78-80s/40-42s recent baseline, revert despite the proxy win."}}
{"run":69,"commit":"791c34c","metric":70,"metrics":{"web_local_s":9.082,"web_trunk_build_s":1.606,"web_trunk_build_cold_s":7.427,"web_trunk_build_cold_system_wasm_bindgen_s":1.608,"web_static_suites_s":0,"mcp_local_s":1.525,"tui_local_s":6.91,"modeled_jobs":4,"modeled_unknown_steps":0,"observed_ci_run_id":25201875826,"observed_ci_run_count":1,"observed_ci_selection_tier":2,"observed_ci_matching_run_count":17,"observed_ci_exact_runtime_run_count":1,"observed_ci_exact_run_runtime_count":1,"observed_ci_view_failure_count":0},"status":"keep","description":"Exact CI validation for clipped pixel-sampling screenshots showed the web job dropped to 72s while preserving all web checks.","timestamp":1777608987841,"segment":2,"confidence":14.860333333333335,"asi":{"hypothesis":"The clipped page screenshot helper should reduce actual GitHub Actions legacy Playwright time because visual tests no longer encode/decode full-canvas PNGs for a few pixel probes.","verification":"Pushed commit 9dcd055 and watched GitHub Actions run 25201875826 complete successfully. It preserved web-preflight, web BDD, web legacy Playwright, MCP, and TUI checks. The web job completed in 1m12s, improving over recent 78-80s exact runs; `./autoresearch.sh` then re-anchored on that exact CI run with projected_ci_s=70 and selection tier 2.","real_ci_run_id":25201875826,"real_ci_web_job_s":72,"real_ci_web_preflight_s":14,"real_ci_mcp_s":16,"real_ci_tui_s":38,"next_action_hint":"Keep the clipped screenshot helper. Continue with another high-signal legacy runtime experiment or re-run exact CI once more only if later evidence suggests the 72s web job was a favorable outlier."}}
{"run":70,"commit":"0000000","metric":76.218,"metrics":{"web_local_s":8.827,"web_trunk_build_s":1.618,"web_trunk_build_cold_s":11.218,"web_trunk_build_cold_system_wasm_bindgen_s":1.639,"web_static_suites_s":0,"mcp_local_s":1.635,"tui_local_s":6.481,"modeled_jobs":4,"modeled_unknown_steps":0,"observed_ci_run_id":25201875826,"observed_ci_run_count":5,"observed_ci_selection_tier":1,"observed_ci_matching_run_count":17,"observed_ci_exact_runtime_run_count":0,"observed_ci_exact_run_runtime_count":0,"observed_ci_view_failure_count":0},"status":"discard","description":"Tried DOMContentLoaded navigation before explicit readiness waits, but it regressed against the new exact clipped-screenshot baseline.","timestamp":1777609262750,"segment":2,"confidence":14.860333333333335,"asi":{"hypothesis":"Since every BDD/legacy navigation is followed by explicit egui readiness and state-vector waits, using `waitUntil: 'domcontentloaded'` instead of full load might start those readiness waits earlier and reduce repeated page startup time without weakening validation.","verification":"Added unit/source tests requiring `openEguiApp` and legacy Playwright page loads to use DOMContentLoaded, updated the helper and all standard WebGPU legacy `page.goto('/')` calls, ran `pnpm -C apps/egui-web run test:preflight`, ran CI-like external-server `pnpm run test:bdd` and `pnpm run test:pw-legacy`, and ran `./autoresearch.sh` successfully.","rollback_reason":"Although targeted tests passed and web_local_s was slightly lower, the projected metric was 76.218s, worse than the newly exact-validated clipped-screenshot baseline of 70s (CI run 25201875826). The selector was runtime-dirty tier 1 with no exact runtime CI matches, so this is not worth another real CI run.","next_action_hint":"Do not pursue navigation-load micro-tuning unless combined with a larger startup model change and a clear local/proxy win versus the 70s exact baseline."}}
{"run":71,"commit":"0000000","metric":76.989,"metrics":{"web_local_s":8.854,"web_trunk_build_s":1.611,"web_trunk_build_cold_s":11.989,"web_trunk_build_cold_system_wasm_bindgen_s":1.628,"web_static_suites_s":0,"mcp_local_s":1.566,"tui_local_s":6.845,"modeled_jobs":4,"modeled_unknown_steps":0,"observed_ci_run_id":25201875826,"observed_ci_run_count":5,"observed_ci_selection_tier":1,"observed_ci_matching_run_count":17,"observed_ci_exact_runtime_run_count":0,"observed_ci_exact_run_runtime_count":0,"observed_ci_view_failure_count":0},"status":"discard","description":"Tried removing the legacy Playwright copy of the BDD-owned state-panel drag-preview z-order scenario, but proxy regressed versus the exact baseline.","timestamp":1777609593461,"segment":2,"confidence":14.860333333333335,"asi":{"hypothesis":"The state-panel drag-preview z-order assertion is covered by the Cucumber BDD feature using the same helper/assertion path, so deleting the duplicate legacy Playwright test might preserve semantic coverage while removing one legacy browser page/test from the critical path.","verification":"Added a source test proving the BDD feature owns the scenario and legacy Playwright no longer duplicates the test name, removed the duplicate legacy test block, ran `pnpm -C apps/egui-web run test:preflight`, ran CI-like external-server `pnpm run test:bdd` and `pnpm run test:pw-legacy` (12 tests), and ran `./autoresearch.sh` successfully.","rollback_reason":"The projected metric was 76.989s, worse than the exact clipped-screenshot baseline of 70s. The run remained runtime-dirty tier 1 with zero exact runtime CI matches, and the coverage tradeoff is not worth a real CI run without a proxy win.","next_action_hint":"Avoid removing duplicate BDD/legacy scenarios unless the benchmark can show a clear win or the duplication is causing maintenance harm. Prefer optimizations that keep all existing assertions in place."}}
