{"run":50,"commit":"dbdfeb6","metric":78,"metrics":{"web_local_s":7.675,"web_trunk_build_s":1.334,"web_trunk_build_cold_s":2.901,"web_trunk_build_cold_system_wasm_bindgen_s":1.345,"mcp_local_s":1.229,"tui_local_s":6.852,"modeled_jobs":3,"modeled_unknown_steps":0,"observed_ci_run_id":25166828471,"observed_ci_run_count":5},"status":"keep","description":"Extend the proxy so workflow-dirty candidates can still reuse observed run-step durations when the app/test runtime files match the current branch state.","timestamp":1777554684947,"segment":4,"confidence":14.978860888027326,"asi":{"hypothesis":"For workflow-dirty candidates, step-name matching alone is too weak but full exact-runtime matching is too strict. If the app/test runtime files still match successful CI runs, the proxy should reuse those observed run-step durations instead of dropping all the way to optimistic local timings.","root_cause_evidence":"After `af59406`, the proxy was realistic for exact current-branch matches (~82s vs ~87s actual), but workflow-dirty candidates like the split-preflight draft still collapsed to implausible ~26s because any workflow change disabled reuse of observed run-step durations and forced all known commands back to fast local timings. The missing middle ground was 'runtime-code exact, workflow dirty'.","benchmark_change":"`autoresearch.sh` now distinguishes three cases: (1) exact workflow + exact runtime match, which reuses observed per-job-step durations for everything; (2) workflow-dirty but runtime-code exact, which reuses observed run-step durations gathered from successful runs whose runtime files match the current branch while still modeling setup/topology through the existing workflow-aware path; and (3) no runtime-code exact match, which still falls back to local timings for known run steps.","verification":"The first attempt hit an unrelated transient legacy benchmark flake, but the preserved benchmark change then passed on rerun of `./autoresearch.sh`. The resulting projected metric for the current branch moved to `78s`, and the branch now has the machinery needed to evaluate workflow-dirty candidates like split-preflight without collapsing to unrealistically low local-only totals.","changed_files":["autoresearch.sh"],"rollback_reason":"","next_action_hint":"Re-evaluate the split-`web-preflight` candidate next under this improved benchmark. It was previously discarded specifically because the workflow-dirty fallback was too optimistic; this new model should give a much more credible signal."}}
{"run":51,"commit":"4b48fb2","metric":74,"metrics":{"web_local_s":7.811,"web_trunk_build_s":1.334,"web_trunk_build_cold_s":3.123,"web_trunk_build_cold_system_wasm_bindgen_s":1.354,"mcp_local_s":1.217,"tui_local_s":6.778,"modeled_jobs":4,"modeled_unknown_steps":0,"observed_ci_run_id":25166828471,"observed_ci_run_count":5},"status":"keep","description":"Split `Web preflight` into its own parallel `web-preflight` job so the main `web` job can start `trunk build` immediately while preserving the existing web validation coverage.","timestamp":1777554832049,"segment":4,"confidence":13.840498123507347,"asi":{"hypothesis":"`Web preflight` is a short node-only validation step on the current web critical path. Moving it into its own parallel job should preserve coverage while shaving a few seconds from the main web job’s wall time.","root_cause_evidence":"After the workflow-dirty benchmark fix in `dbdfeb6`, this candidate no longer collapses to an implausible local-only number. The updated proxy now estimates `74s`, a believable improvement over the current ~`78s` projected branch baseline that roughly matches the size of the `Web preflight` step observed in recent real CI runs.","verification":"Updated `.github/workflows/ci.yml` to add a `web-preflight` job with the existing Node/pnpm preflight flow, removed `Web preflight` from the main `web` job, and reran `./autoresearch.sh` successfully. The workflow still modeled with zero unknown steps and preserved all existing validation commands.","rollback_reason":"","next_action_hint":"Push this split-preflight workflow to real CI next. If the actual wall clock or the main `web` job beats the current ~87s branch state without introducing workflow-management downsides, keep it; otherwise revert and treat the gain as too small for the extra job complexity."}}
{"run":52,"commit":"9c24835","metric":66,"metrics":{"web_local_s":8.005,"web_trunk_build_s":1.401,"web_trunk_build_cold_s":3.076,"web_trunk_build_cold_system_wasm_bindgen_s":1.39,"mcp_local_s":1.473,"tui_local_s":6.746,"modeled_jobs":5,"modeled_unknown_steps":0,"observed_ci_run_id":25167426445,"observed_ci_run_count":5},"status":"keep","description":"Split `Web Cucumber BDD (static dist)` into its own parallel `web-bdd` job while keeping `web-preflight` separate and the main `web` job focused on build plus legacy Playwright.","timestamp":1777555338404,"segment":4,"confidence":13.60150880134116,"asi":{"hypothesis":"After the successful preflight split, the next removable chunk from the main web critical path is the BDD static-dist step. Moving BDD into its own parallel job should preserve coverage and let the main `web` job focus on the slower legacy suite.","root_cause_evidence":"With the improved workflow-dirty benchmark from `dbdfeb6`, this candidate is no longer dominated by unrealistic local-only timings. The proxy can reuse observed run-step durations from the current split-preflight branch for runtime-identical commands while remapping the new topology, producing a plausible drop from the current ~74–78s range to `66s` projected.","verification":"Updated `.github/workflows/ci.yml` to add a separate `web-bdd` job that duplicates the existing static-dist build flow and removed the BDD step from the main `web` job, then reran `./autoresearch.sh` successfully. The workflow still has zero unmodeled steps and preserves the full set of web validations.","rollback_reason":"","next_action_hint":"Push this split-BDD topology to real CI next. If actual wall clock and the main `web`/`web-bdd` jobs beat the current split-preflight baseline (`4b48fb2`, run `25167426445`), keep it; otherwise revert and treat the duplicated build/setup costs as too expensive."}}
{"run":53,"commit":"0000000","metric":0,"metrics":{"web_local_s":8.005,"web_trunk_build_s":1.401,"web_trunk_build_cold_s":3.076,"web_trunk_build_cold_system_wasm_bindgen_s":1.39,"mcp_local_s":1.473,"tui_local_s":6.746,"modeled_jobs":5,"modeled_unknown_steps":0,"observed_ci_run_id":25167426445,"observed_ci_run_count":5},"status":"crash","description":"Tried restoring the split-preflight/no-split-BDD topology after real CI disproved the extra `web-bdd` job.","timestamp":1777555651117,"segment":4,"confidence":13.60150880134116,"asi":{"hypothesis":"Real CI run `25167832195` showed the added `web-bdd` job was slower than expected because its duplicated `Web trunk build` ballooned to about 61s and overall wall clock regressed to ~105s. Restoring the previous split-preflight topology should realign the branch with the better actual CI state.","root_cause_evidence":"Actual run `25167832195` falsified the proxy keep for `9c24835`: `web` completed around 81s, but `web-bdd` took roughly 97s, driven by a surprisingly slow `Web trunk build`, and the overall workflow wall clock regressed versus `4b48fb2` run `25167426445`. The first restore benchmarking attempt then hit a transient repeated local legacy-suite failure before the proxy could finish.","rollback_reason":"Cannot complete the restore benchmark cycle from this attempt because the repeated local `test:pw-legacy` benchmark flaked before `./autoresearch.sh` emitted metrics.","next_action_hint":"Re-run the restore benchmark immediately. If the local legacy flake clears—as it often has on retry—keep the revert so the branch matches the better real CI evidence from `25167426445`.","failure_detail":"`run_experiment` failed inside the repeated local `pnpm run test:pw-legacy` benchmark after restoring the split-preflight topology; this appears unrelated to the CI-driven revert itself."}}
{"run":54,"commit":"7fe25f6","metric":73.5,"metrics":{"web_local_s":7.73,"web_trunk_build_s":1.354,"web_trunk_build_cold_s":3.185,"web_trunk_build_cold_system_wasm_bindgen_s":1.348,"mcp_local_s":1.359,"tui_local_s":6.757,"modeled_jobs":4,"modeled_unknown_steps":0,"observed_ci_run_id":25167426445,"observed_ci_run_count":1},"status":"keep","description":"Revert the extra `web-bdd` job and return to the split-preflight topology after real CI showed the duplicated BDD build made the workflow slower overall.","timestamp":1777555910691,"segment":4,"confidence":13.344243421052635,"asi":{"hypothesis":"The split-BDD keep was a workflow-dirty proxy win but real CI overruled it. Returning to the earlier split-preflight topology should restore the branch to the better actual runtime state confirmed by run `25167426445`.","root_cause_evidence":"Real CI run `25167832195` on commit `9c24835` regressed overall wall clock to about 105s. The new `web-bdd` job alone took roughly 97s, with `Web trunk build` inflating to about 61s before BDD even ran, so duplicating the build/setup path cost more than removing BDD from the main `web` critical path saved. By contrast, commit `4b48fb2` run `25167426445` stayed around `web≈78s`, `web-preflight≈14s`, `tui≈36s`, `mcp≈18s`.","verification":"Restored `.github/workflows/ci.yml` to the split-preflight topology, reran `./autoresearch.sh` successfully, and confirmed the proxy now re-anchors on run `25167426445` as the exact matching current-branch baseline.","rollback_reason":"","next_action_hint":"Treat duplicated build jobs as suspect unless there is strong evidence they stay cheap on real CI. Continue from the restored split-preflight baseline and look for another web bottleneck or another benchmark-quality improvement."}}
{"run":55,"commit":"4f31f97","metric":73.5,"metrics":{"web_local_s":7.693,"web_trunk_build_s":1.332,"web_trunk_build_cold_s":3.106,"web_trunk_build_cold_system_wasm_bindgen_s":1.345,"mcp_local_s":1.2,"tui_local_s":6.329,"modeled_jobs":4,"modeled_unknown_steps":0,"observed_ci_run_id":25168329696,"observed_ci_run_count":2},"status":"keep","description":"Make workflow-dirty run-step reuse more conservative: only reuse exact observed run-step timings for matching jobs, and penalize new duplicated compile-heavy jobs instead of borrowing unrealistically cheap timings.","timestamp":1777556375027,"segment":4,"confidence":12.486802616390921,"asi":{"hypothesis":"The workflow-dirty benchmark still overfits when a candidate introduces brand-new jobs with compile-heavy run steps, because generic step-name reuse can make those new jobs look as cheap as existing ones. Restricting exact run-step reuse to matching jobs and treating duplicated compile-heavy steps conservatively should make the proxy safer.","root_cause_evidence":"Real CI run `25167832195` disproved the `web-bdd` split: its new `web-bdd` job inherited an unrealistically cheap `Web trunk build` estimate from existing jobs, but actual CI inflated that duplicated build to about 61s. The missing safeguard was that `exact_run_runtime_step_cost_s['Web trunk build']` was being reused across new job names that had never existed in the matched baseline.","benchmark_change":"`autoresearch.sh` now tracks which job names exist in the runtime-matching successful runs and how many jobs contain each step name. Exact observed run-step durations are reused directly for matching job+step pairs, and generic step-name reuse is limited to jobs that already existed in the runtime-matching baseline. If a workflow-dirty candidate introduces additional compile-heavy run steps beyond that baseline, the proxy now falls back to conservative modeled costs for those new duplicates instead of borrowing exact timings from unrelated jobs.","changed_files":["autoresearch.sh"],"verification":"Reran `./autoresearch.sh` successfully on the restored split-preflight branch. The current branch still projects at `73.5s` while the exact-matching observed run set tightened to the two genuinely matching restored/split-preflight runs, confirming the change did not distort the current validated topology while making future duplicated-build candidates harder to overestimate.","rollback_reason":"","next_action_hint":"Re-evaluate the previously failed `web-bdd` split under this stricter benchmark. It should now look materially less attractive before spending another real CI run on any duplicated-build topology."}}
{"run":56,"commit":"0000000","metric":0,"metrics":{"web_local_s":7.693,"web_trunk_build_s":1.332,"web_trunk_build_cold_s":3.106,"web_trunk_build_cold_system_wasm_bindgen_s":1.345,"mcp_local_s":1.2,"tui_local_s":6.329,"modeled_jobs":4,"modeled_unknown_steps":0,"observed_ci_run_id":25168329696,"observed_ci_run_count":2},"status":"crash","description":"Retried the split-`web-bdd` candidate under the stricter duplicated-build benchmark.","timestamp":1777556498880,"segment":4,"confidence":12.486802616390921,"asi":{"hypothesis":"With duplicated compile-heavy run-step reuse now modeled more conservatively, the split-`web-bdd` topology should look much less attractive than before and ideally self-disqualify in the proxy before another real CI run.","root_cause_evidence":"This reevaluation attempt did not reach the metric because the repeated local legacy benchmark flaked again before `./autoresearch.sh` could finish. The failure happened in the same `pnpm run test:pw-legacy` measurement path that has intermittently crashed in other sessions, so this run does not provide a trustworthy projected number for the candidate.","rollback_reason":"Cannot conclude the candidate’s value from this run because the benchmark crashed before emitting metrics.","next_action_hint":"If revisiting the split-`web-bdd` reevaluation immediately, retry once after the auto-revert. Otherwise deprioritize duplicated-build topologies entirely and move to a different hypothesis; real CI already falsified this lane once.","failure_detail":"`run_experiment` failed during the repeated local `pnpm run test:pw-legacy` benchmark while the `web-bdd` workflow draft was applied."}}
{"run":57,"commit":"0000000","metric":0,"metrics":{"web_local_s":7.693,"web_trunk_build_s":1.332,"web_trunk_build_cold_s":3.106,"web_trunk_build_cold_system_wasm_bindgen_s":1.345,"mcp_local_s":1.2,"tui_local_s":6.329,"modeled_jobs":4,"modeled_unknown_steps":0,"observed_ci_run_id":25168329696,"observed_ci_run_count":2},"status":"crash","description":"Tried adding per-job hidden-overhead modeling so the proxy includes job wall-clock time not captured by the summed observed step durations.","timestamp":1777556913051,"segment":4,"confidence":12.486802616390921,"asi":{"hypothesis":"Even with exact observed step reuse, the proxy still underestimates actual CI because GitHub job wall time contains overhead not captured by the explicit step durations we sum. Modeling per-job overhead from exact successful runs should bring projected wall time closer to real CI.","root_cause_evidence":"The current split-preflight branch still projects around `73.5s` while its real successful CI runs are materially slower. Inspection suggests GitHub job wall time includes non-step overhead (e.g. gaps and post-step time) beyond the counted step durations. The first validation attempt for this benchmark change hit another transient repeated `test:pw-legacy` measurement failure before metrics were emitted.","rollback_reason":"Cannot judge the benchmark-improvement candidate from this attempt because `./autoresearch.sh` crashed in the flaky repeated local legacy benchmark before finishing.","next_action_hint":"Reapply the saved per-job-overhead patch and rerun the same benchmark-improvement experiment. If the retry clears the transient local legacy flake, keep the change if it moves the proxy closer to the real split-preflight CI wall time.","failure_detail":"`run_experiment` failed during the repeated local `pnpm run test:pw-legacy` benchmark before the per-job-overhead model could emit metrics."}}
{"run":58,"commit":"70e77db","metric":80,"metrics":{"web_local_s":7.737,"web_trunk_build_s":1.356,"web_trunk_build_cold_s":2.965,"web_trunk_build_cold_system_wasm_bindgen_s":1.355,"mcp_local_s":1.22,"tui_local_s":6.82,"modeled_jobs":4,"modeled_unknown_steps":0,"observed_ci_run_id":25168767233,"observed_ci_run_count":3},"status":"keep","description":"Model per-job hidden overhead from exact successful CI runs so the proxy includes wall-clock time not captured by summed counted step durations.","timestamp":1777557115627,"segment":4,"confidence":11.732899493853942,"asi":{"hypothesis":"Even with exact observed step reuse, the proxy still underestimates actual CI because GitHub job wall time contains overhead not captured by the summed explicit step durations. Adding per-job hidden overhead from exact successful runs should bring the projected wall time closer to reality.","root_cause_evidence":"The restored split-preflight branch was still projecting around `73.5s` even though exact successful CI runs of the same topology were materially slower. Inspection of recent runs showed that the job wall-clock duration exceeds the sum of the counted step durations, implying additional overhead from gaps, post-step work, or other GitHub-managed time not already included in the step sum.","benchmark_change":"`autoresearch.sh` now computes per-job hidden overhead from successful exact-matching runs as `(job wall time) - (sum of counted step durations)` and adds the median overhead back into the modeled job totals. The same mechanism is also available for runtime-code-exact workflow-dirty candidates via the runtime-matching job baselines.","verification":"After one transient legacy benchmark flake on the first attempt, reran `./autoresearch.sh` successfully with the same code change preserved. The projected metric moved from ~`73.5s` to `80s`, and the selector anchored on the now-current exact runtime run set headed by `25168767233`, making the proxy materially closer to real split-preflight CI behavior.","changed_files":["autoresearch.sh"],"rollback_reason":"","next_action_hint":"Use this more conservative proxy for future topology experiments. The next promising work is a non-stale legacy-lane idea or another benchmark-quality fix, but it should now need fewer real-CI corrections than before."}}
{"run":59,"commit":"0000000","metric":0,"metrics":{"web_local_s":7.704,"web_trunk_build_s":1.344,"web_trunk_build_cold_s":4.319,"web_trunk_build_cold_system_wasm_bindgen_s":1.358,"mcp_local_s":1.212,"tui_local_s":6.485,"modeled_jobs":4,"modeled_unknown_steps":0,"observed_ci_run_id":25168767233,"observed_ci_run_count":3},"status":"crash","description":"Tried removing success-only screenshot file writes from the legacy Playwright hot path so the first WebGPU rendering test no longer saves three PNG artifacts on passing runs.","timestamp":1777557826470,"segment":4,"confidence":11.732899493853942,"asi":{"hypothesis":"The slowest individual legacy Playwright test still performs three success-only PNG file writes (`initial`, `after`, and a final canvas screenshot). Removing those hot-path writes while keeping the semantic assertions should shave a small amount of CI time without reducing validation coverage.","root_cause_evidence":"A focused CI-like rerun of `egui webgpu canvas renders content` stayed green after removing the screenshot paths, and the one-test median nudged from roughly `2.72s` to `2.69s`, suggesting only a small win at best. The first full `./autoresearch.sh` attempt then failed in the existing flaky repeated `pnpm run test:pw-legacy` benchmark before the branch metric could be measured.","verification_before_crash":"Observed the new unit test fail first, removed the success-only screenshot paths from `apps/egui-web/tests/egui-web.spec.js`, reran the targeted unit test and full `pnpm -C apps/egui-web run test:preflight`, and ran one CI-like full `pnpm run test:pw-legacy` pass successfully before the benchmark crash.","rollback_reason":"Cannot judge this micro-optimization from the crashed benchmark attempt; the known flaky repeated legacy measurement failed before `./autoresearch.sh` emitted metrics.","next_action_hint":"If retrying immediately, reapply the tiny screenshot-write removal and run the experiment once more. If the retry still shows no clear projected win, prune this lane as too small/noisy compared with the remaining legacy-step bottleneck.","failure_detail":"`run_experiment` failed inside the repeated local `pnpm run test:pw-legacy` benchmark command; the server log shows traffic only, not a deterministic app/runtime failure attributable to the screenshot-write removal."}}
